all_awardings,associated_award,author,author_flair_background_color,author_flair_css_class,author_flair_richtext,author_flair_template_id,author_flair_text,author_flair_text_color,author_flair_type,author_fullname,author_patreon_flair,author_premium,awarders,body,collapsed_because_crowd_control,comment_type,created_utc,gildings,id,is_submitter,link_id,locked,no_follow,parent_id,permalink,retrieved_on,score,send_replies,stickied,subreddit,subreddit_id,top_awarded_type,total_awards_received,treatment_tags,distinguished,author_cakeday
[],,cmarocha,,,[],,,,text,t2_4bj5bq3m,False,False,[],Dang I tried a month ago the snow was super deep. What route did you take ?,,,1619210873,{},gvlyjm4,False,t3_mwkx2g,False,True,t1_gvkru47,/r/hiking/comments/mwkx2g/summit_of_el_capitan_yosemite_national_park_usa/gvlyjm4/,1619227382,2,True,False,hiking,t5_2r9om,,0,[],,
[],,AutoModerator,,,[],,,,text,t2_6l4z3,False,True,[],"
I see you've posted an image.  Thanks for your contribution!

*Did you included the* ***required*** *title information?*  **[Your text.] [Most Specific place], [Specific place], [General place], [COUNTRY].**  
      
If you didn't include this information, please delete your post and resubmit it.  **Your post will be removed without warning if it does not follow this rule!**


*I am a bot, and this action was performed automatically. Please [contact the moderators of this subreddit](/message/compose/?to=/r/hiking) if you have any questions or concerns.*",,,1619210659,{},gvly2r7,False,t3_mx4nzt,False,True,t3_mx4nzt,/r/hiking/comments/mx4nzt/looking_south_from_the_top_of_the_fire_tower_on/gvly2r7/,1619227124,1,False,False,hiking,t5_2r9om,,0,[],moderator,
[],,weristjonsnow,,,[],,,,text,t2_xxv34ex,False,False,[],I can't tell what is more impressive: the wild or that smile,,,1619210404,{},gvlxj2d,False,t3_mx339m,False,True,t3_mx339m,/r/hiking/comments/mx339m/blanca_lake_in_washington_usa/gvlxj2d/,1619226822,-28,True,False,hiking,t5_2r9om,,0,[],,
[],,DirtyBackpacker,,,[],,,,text,t2_mr7gctw,False,False,[],"This isn't part of  the Smokey Mountains. This is in the Dupont State Recreational Forest, south of Ashville, NC.",,,1619210285,{},gvlx9ts,False,t3_mx33hp,False,True,t3_mx33hp,/r/hiking/comments/mx33hp/triple_falls_smoky_mountains_north_carolina_usa/gvlx9ts/,1619226682,2,True,False,hiking,t5_2r9om,,0,[],,
[],,ordinary-philosopher,,,[],,,,text,t2_5cbtk9pa,False,False,[],I was just thinking about this the other day but I can’t seem to find any information on the use of prescribed fire by the Native Americans. Do you know of any references?,,,1619210285,{},gvlx9td,False,t3_mwojhi,False,True,t1_gvk0r44,/r/hiking/comments/mwojhi/life_returning_to_wildfire_burn_area_fall_creek/gvlx9td/,1619226681,1,True,False,hiking,t5_2r9om,,0,[],,
[],,outdoorseveryday,,,[],,,,text,t2_o5v48ko,False,False,[],I started at Yosemite Creek Campground and camped one night off the trail. A bear walked around my tent and was checking out my food hang (it was the normal way of storing food back then). Not much elevation change to get to El Cap. I found the metal box that people put messages in. One said they witnessed a helicopter rescue of a climber...two days earlier!,,,1619209657,{},gvlvwbb,False,t3_mwkx2g,False,True,t1_gvj0271,/r/hiking/comments/mwkx2g/summit_of_el_capitan_yosemite_national_park_usa/gvlvwbb/,1619225937,2,True,False,hiking,t5_2r9om,,0,[],,
[],,AutoModerator,,,[],,,,text,t2_6l4z3,False,True,[],"
I see you've posted an image.  Thanks for your contribution!

*Did you included the* ***required*** *title information?*  **[Your text.] [Most Specific place], [Specific place], [General place], [COUNTRY].**  
      
If you didn't include this information, please delete your post and resubmit it.  **Your post will be removed without warning if it does not follow this rule!**


*I am a bot, and this action was performed automatically. Please [contact the moderators of this subreddit](/message/compose/?to=/r/hiking) if you have any questions or concerns.*",,,1619209581,{},gvlvq97,False,t3_mx4awb,False,True,t3_mx4awb,/r/hiking/comments/mx4awb/visiting_my_23rd_national_park_today_hot_springs/gvlvq97/,1619225847,1,False,False,hiking,t5_2r9om,,0,[],moderator,
[],,Salty_Mitochondrion,,,[],,,,text,t2_22ujx7e2,False,False,[],"I wish! My wife was waiting at 13,000, clouds were moving fast and it looked like it was gonna come down so I played it safe. I’ll be back though 💪🏽",,,1619209254,{},gvlv077,True,t3_mwnzix,False,True,t1_gvlojb4,/r/hiking/comments/mwnzix/hiked_my_very_first_14er_grays_peak_in_colorado/gvlv077/,1619225460,1,True,False,hiking,t5_2r9om,,0,[],,
[],,RathAdventures,,,[],,,,text,t2_8u21dnft,False,False,[],Says the guy who replies twice to the same comment lmao.,,,1619209194,{},gvluve1,False,t3_mvfb0j,False,True,t1_gvlqu8c,/r/hiking/comments/mvfb0j/hiking_on_skis/gvluve1/,1619225390,1,True,False,hiking,t5_2r9om,,0,[],,
[],,Salty_Mitochondrion,,,[],,,,text,t2_22ujx7e2,False,False,[],Thanks!,,,1619209182,{},gvluugk,True,t3_mwnzix,False,True,t1_gvla1r6,/r/hiking/comments/mwnzix/hiked_my_very_first_14er_grays_peak_in_colorado/gvluugk/,1619225375,1,True,False,hiking,t5_2r9om,,0,[],,
[],,trailsnailprincess,,,[],,,,text,t2_3b194p86,False,False,[],"If you meet a fella on the thru named Brandon, unsure of his trail name... A blonde tall fellow from avl nc, tell him hello!",,,1619209084,{},gvlump2,False,t3_mwjn2t,False,True,t3_mwjn2t,/r/hiking/comments/mwjn2t/foggy_morning_on_the_pct_mt_laguna_san_diego/gvlump2/,1619225261,1,True,False,hiking,t5_2r9om,,0,[],,
[],,Find_A_Reason,,,[],,,,text,t2_8xgen7zg,False,False,[],If we knew your general area we could recommend some places for you to go experience what typical casual hiking in the U.S. is. It is not the large expedition style trekking you are referring to.,,,1619208937,{},gvlub85,False,t3_mwumwd,False,True,t3_mwumwd,/r/hiking/comments/mwumwd/advice_on_hiking_in_usa/gvlub85/,1619225093,2,True,False,hiking,t5_2r9om,,0,[],,
[],,reddikan,,,[],,,,text,t2_137i8c,False,False,[],i hiked that one a couple years ago.  loved the views!,,,1619208110,{},gvlshqi,False,t3_mx3gdk,False,True,t3_mx3gdk,/r/hiking/comments/mx3gdk/recently_hiked_goat_trail_in_arkansas_truly/gvlshqi/,1619224138,2,True,False,hiking,t5_2r9om,,0,[],,
[],,KoraxTheVagabond,,,[],,,,text,t2_a0mw71ob,False,False,[],I think the mind processes some old baggage which is good. We distract ourselves too much,,,1619207543,{},gvlr9ja,True,t3_mx1qoy,False,True,t1_gvlorhu,/r/hiking/comments/mx1qoy/feeling_depressed_during_trips/gvlr9ja/,1619223474,1,True,False,hiking,t5_2r9om,,0,[],,
[],,ivanat94,,,[],,,,text,t2_43v6hzc9,False,False,[],So...get a life 😂,,,1619207351,{},gvlqu8c,True,t3_mvfb0j,False,True,t1_gvd1tnn,/r/hiking/comments/mvfb0j/hiking_on_skis/gvlqu8c/,1619223235,0,True,False,hiking,t5_2r9om,,0,[],,
[],,ivanat94,,,[],,,,text,t2_43v6hzc9,False,False,[],So... you are annoying,,,1619207341,{},gvlqtf6,True,t3_mvfb0j,False,True,t1_gvd1tnn,/r/hiking/comments/mvfb0j/hiking_on_skis/gvlqtf6/,1619223222,0,True,False,hiking,t5_2r9om,,0,[],,
[],,Subliminationnation,,,[],,,,text,t2_b4bfwcmm,False,False,[],"&gt; I meant there was a social-cultural practice on the part of euro- descended Americans for a long time of not doing prescribed burns on our vast public lands and instead allowing fuel to build

Euro-descended Americans didn't even have access to the entire continent until like 1900. I don't know how they would have ""managed"" the land out west, in 1865 or so when Euro-Americans were barely even there. Plus, when it is a wilderness, nature should be the one to manage the land... not humans.",,,1619207222,{},gvlqk1s,False,t3_mwojhi,False,True,t1_gvlj6dj,/r/hiking/comments/mwojhi/life_returning_to_wildfire_burn_area_fall_creek/gvlqk1s/,1619223079,0,True,False,hiking,t5_2r9om,,0,[],,
[],,Jpf123,,,[],,,,text,t2_vkfgf,False,False,[],"Yeah, is there still ice or snow?",,,1619206988,{},gvlq1m0,False,t3_mwti9o,False,True,t1_gvks638,/r/hiking/comments/mwti9o/my_friend_is_a_great_photographer_so_i_always/gvlq1m0/,1619222794,2,True,False,hiking,t5_2r9om,,0,[],,
[],,AutoModerator,,,[],,,,text,t2_6l4z3,False,True,[],"
I see you've posted an image.  Thanks for your contribution!

*Did you included the* ***required*** *title information?*  **[Your text.] [Most Specific place], [Specific place], [General place], [COUNTRY].**  
      
If you didn't include this information, please delete your post and resubmit it.  **Your post will be removed without warning if it does not follow this rule!**


*I am a bot, and this action was performed automatically. Please [contact the moderators of this subreddit](/message/compose/?to=/r/hiking) if you have any questions or concerns.*",,,1619206853,{},gvlpr1t,False,t3_mx3cs1,False,True,t3_mx3cs1,/r/hiking/comments/mx3cs1/spirit_falls_westfir_or/gvlpr1t/,1619222629,1,False,False,hiking,t5_2r9om,,0,[],moderator,
[],,Calico270,,,[],,,,text,t2_beo6pv9t,False,False,[],Happy 30th Birthday! Amazing way to celebrate.,,,1619206640,{},gvlpa9u,False,t3_mwwhz6,False,True,t3_mwwhz6,/r/hiking/comments/mwwhz6/celebrated_my_30th_birthday_on_angels_landing_in/gvlpa9u/,1619222378,1,True,False,hiking,t5_2r9om,,0,[],,
[],,hugdattree,,,[],,,,text,t2_6f98mibs,False,False,[],"I noticed my mind races when I go hiking about lots of random things, I used to be calmer. I use the time to refocus and clear my mind, focus on my breathing, and adjust my posture noticing if my shoulders or jaw is tight or locked. Maybe some type of meditationy technique will help",,,1619206404,{},gvlorhu,False,t3_mx1qoy,False,False,t3_mx1qoy,/r/hiking/comments/mx1qoy/feeling_depressed_during_trips/gvlorhu/,1619222100,2,True,False,hiking,t5_2r9om,,0,[],,
[],,KoraxTheVagabond,,,[],,,,text,t2_a0mw71ob,False,False,[],"I can relate to that. At home I distract myself from negative thoughts. Now im far from home and alone in a random forrest side thinking about my past. Old  relationships and people I miss. All thoses memories are coming up like flashbacks. Sorrow, anger, sadness, love, hate. They all came up since this morning.",,,1619206382,{},gvlopva,True,t3_mx1qoy,False,False,t1_gvln6bo,/r/hiking/comments/mx1qoy/feeling_depressed_during_trips/gvlopva/,1619222075,1,True,False,hiking,t5_2r9om,,0,[],,
[],,JimmyHeart187,,,[],,,,text,t2_bjd404wd,False,False,[],The climate has chsnged since the dawn of time. I do agree we are accelerating it with overpopulation and pollution but there's a statistic that 3% of corporations cause 71% of the pollution. Most modern wild fires are caused by morons starting them intentionally or dumb ass gender reveal parties etc. I do my part and don't litter and keep my house green as possible but in actuality the climate has always gone through cycles of change. Controlled burns and people not being morons is a better way to prevent wild fires.,,,1619206370,{},gvloovs,False,t3_mwojhi,False,True,t1_gvk9yig,/r/hiking/comments/mwojhi/life_returning_to_wildfire_burn_area_fall_creek/gvloovs/,1619222061,-1,True,False,hiking,t5_2r9om,,0,[],,
[],,jkapowie,,,[],,,,text,t2_3ma4l7s8,False,False,[],I love this trail! Did you go to Torrey’s?,,,1619206299,{},gvlojb4,False,t3_mwnzix,False,True,t3_mwnzix,/r/hiking/comments/mwnzix/hiked_my_very_first_14er_grays_peak_in_colorado/gvlojb4/,1619221979,2,True,False,hiking,t5_2r9om,,0,[],,
[],,Charbear206,,,[],,,,text,t2_b9dft32g,False,False,[],Thank you!!,,,1619206200,{},gvlobjb,True,t3_mwvgmg,False,True,t1_gvkvwuw,/r/hiking/comments/mwvgmg/tolmie_peak_fire_look_out_at_mount_rainer_in/gvlobjb/,1619221866,-4,True,False,hiking,t5_2r9om,,0,[],,
[],,Charbear206,,,[],,,,text,t2_b9dft32g,False,False,[],Thank you!!!!!  Dollar store!,,,1619206130,{},gvlo60o,True,t3_mwy3we,False,True,t1_gvlnqq2,/r/hiking/comments/mwy3we/snow_lake_east_of_seattle_near_snoquamie/gvlo60o/,1619221785,1,True,False,hiking,t5_2r9om,,0,[],,
[],,AutoModerator,,,[],,,,text,t2_6l4z3,False,True,[],"
I see you've posted an image.  Thanks for your contribution!

*Did you included the* ***required*** *title information?*  **[Your text.] [Most Specific place], [Specific place], [General place], [COUNTRY].**  
      
If you didn't include this information, please delete your post and resubmit it.  **Your post will be removed without warning if it does not follow this rule!**


*I am a bot, and this action was performed automatically. Please [contact the moderators of this subreddit](/message/compose/?to=/r/hiking) if you have any questions or concerns.*",,,1619206102,{},gvlo3uq,False,t3_mx33hp,False,True,t3_mx33hp,/r/hiking/comments/mx33hp/triple_falls_smoky_mountains_north_carolina_usa/gvlo3uq/,1619221753,1,False,False,hiking,t5_2r9om,,0,[],moderator,
[],,AutoModerator,,,[],,,,text,t2_6l4z3,False,True,[],"
I see you've posted an image.  Thanks for your contribution!

*Did you included the* ***required*** *title information?*  **[Your text.] [Most Specific place], [Specific place], [General place], [COUNTRY].**  
      
If you didn't include this information, please delete your post and resubmit it.  **Your post will be removed without warning if it does not follow this rule!**


*I am a bot, and this action was performed automatically. Please [contact the moderators of this subreddit](/message/compose/?to=/r/hiking) if you have any questions or concerns.*",,,1619206085,{},gvlo2e8,False,t3_mx339m,False,True,t3_mx339m,/r/hiking/comments/mx339m/blanca_lake_in_washington_usa/gvlo2e8/,1619221731,1,False,False,hiking,t5_2r9om,,0,[],moderator,
[],,AGDemAGSup,,,[],,,,text,t2_atm04kdr,False,False,[],"We live in a society... where respect for our 
environment has become an afterthought of consumerism, no longer intuition or something to live by.",,,1619205990,{},gvlnutd,False,t3_mwmwl9,False,True,t3_mwmwl9,/r/hiking/comments/mwmwl9/one_of_my_favorite_local_trails_was_recently/gvlnutd/,1619221620,1,True,False,hiking,t5_2r9om,,0,[],,
[],,[deleted],,,,,,dark,,,,,[],[deleted],,,1619205953,{},gvlnrvt,False,t3_mwmwl9,False,True,t3_mwmwl9,/r/hiking/comments/mwmwl9/one_of_my_favorite_local_trails_was_recently/gvlnrvt/,1619221576,1,True,False,hiking,t5_2r9om,,0,[],,
[],,SilentBurden,,,[],,,,text,t2_ayvnug0u,False,False,[],I like your sunglasses!! 😎,,,1619205939,{},gvlnqq2,False,t3_mwy3we,False,True,t3_mwy3we,/r/hiking/comments/mwy3we/snow_lake_east_of_seattle_near_snoquamie/gvlnqq2/,1619221559,2,True,False,hiking,t5_2r9om,,0,[],,
[],,[deleted],,,,,,dark,,,,,[],[deleted],,,1619205861,{},gvlnkij,False,t3_mwmwl9,False,True,t3_mwmwl9,/r/hiking/comments/mwmwl9/one_of_my_favorite_local_trails_was_recently/gvlnkij/,1619221467,1,True,False,hiking,t5_2r9om,,0,[],,
[],,ju_lz_929,,,[],,,,text,t2_aqz7bfms,False,False,[],Incredible 🌱🥺,,,1619205857,{},gvlnk74,False,t3_mwojhi,False,True,t3_mwojhi,/r/hiking/comments/mwojhi/life_returning_to_wildfire_burn_area_fall_creek/gvlnk74/,1619221462,2,True,False,hiking,t5_2r9om,,0,[],,
[],,Tydrumdrumm,,,[],,,,text,t2_29iy6jkk,False,False,[],I always end up thinking too much on the trails.. then I’m stuck with those thoughts beside the campfire. It’s always good to stay ingratiated in the trip itself. The what and where and the technical side of the trips too. That way you don’t tend to loom there in that headspace for long.,,,1619205683,{},gvln6bo,False,t3_mx1qoy,False,True,t3_mx1qoy,/r/hiking/comments/mx1qoy/feeling_depressed_during_trips/gvln6bo/,1619221256,1,True,False,hiking,t5_2r9om,,0,[],,
[],,sweerek1,,,[],,,,text,t2_2mj65tsl,False,False,[],https://www.mountaineers.org/blog/what-are-the-ten-essentials,,,1619205629,{},gvln1x1,False,t3_mwwd4s,False,True,t3_mwwd4s,/r/hiking/comments/mwwd4s/first_responders_share_tips_for_staying_safe_out/gvln1x1/,1619221191,1,True,False,hiking,t5_2r9om,,0,[],,
[],,Melly_Meow,,,[],,,,text,t2_ac13b2uz,False,False,[],The same kind of bros who blast music while hiking for everyone in the area to hear...,,,1619205528,{},gvlmtmj,False,t3_mwmwl9,False,True,t3_mwmwl9,/r/hiking/comments/mwmwl9/one_of_my_favorite_local_trails_was_recently/gvlmtmj/,1619221068,1,True,False,hiking,t5_2r9om,,0,[],,
[],,KoraxTheVagabond,,,[],,,,text,t2_a0mw71ob,False,False,[],I should embrace it as you mentioned,,,1619205329,{},gvlmdzk,True,t3_mx1qoy,False,True,t1_gvlisc7,/r/hiking/comments/mx1qoy/feeling_depressed_during_trips/gvlmdzk/,1619220832,1,True,False,hiking,t5_2r9om,,0,[],,
[],,KoraxTheVagabond,,,[],,,,text,t2_a0mw71ob,False,False,[],"Usually i love longer trips but this time I had this feeling till this morning. now it's 9 pm and im preparing to sleep.

Maybe the weather was too good? My best trips were challenging with lots of rain and wind. I know it sounds strange",,,1619205262,{},gvlm8ql,True,t3_mx1qoy,False,False,t1_gvljo4n,/r/hiking/comments/mx1qoy/feeling_depressed_during_trips/gvlm8ql/,1619220752,1,True,False,hiking,t5_2r9om,,0,[],,
[],,BucksBrew,,,[],,,,text,t2_a8a7o,False,False,[],"Instead of showing us amazing views of one of the most striking peaks in the country, if not the world, you just posted pics or yourself?",,,1619205189,{},gvlm2tz,False,t3_mwvgmg,False,False,t3_mwvgmg,/r/hiking/comments/mwvgmg/tolmie_peak_fire_look_out_at_mount_rainer_in/gvlm2tz/,1619220664,9,True,False,hiking,t5_2r9om,,0,[],,
[],,RandomErrer,,,[],,,,text,t2_bebrx,False,False,[],"It looks like the [threads on gas cannister cartridges weren't standardized until 1992](https://en.wikipedia.org/wiki/Portable_stove#Gas_cartridge_stoves), so maybe your stove is at least that old. The GigaPower was [introduced in 1998](https://www.snowpeak.com/blogs/explore/tiny-but-mighty) and I remember it was a big deal because dealing with liquid fuel stoves (even small ones like the MSR Whisperlight) was a pain in the ass - pump, prime, light, pump some more, etc. I got my Gigapower in 2001, and I remember it being so much easier to use.",,,1619205027,{},gvllpup,False,t3_mw8mns,False,True,t1_gvkhylm,/r/hiking/comments/mw8mns/anyone_have_any_info_on_this_old_camp_stove/gvllpup/,1619220468,1,True,False,hiking,t5_2r9om,,0,[],,
[],,AdurxIsd,,,[],,,,text,t2_bh19iz4,False,False,[],Quite the opposite for me. What exactly makes you feel depressed?,,,1619204106,{},gvljo4n,False,t3_mx1qoy,False,True,t3_mx1qoy,/r/hiking/comments/mx1qoy/feeling_depressed_during_trips/gvljo4n/,1619219323,1,True,False,hiking,t5_2r9om,,0,[],,
[],,rmscoot,,,[],,,,text,t2_a8m07ppf,False,False,[],"I meant there was a social-cultural practice on the part of euro- descended Americans for a long time of not doing prescribed burns on our vast public lands and instead allowing fuel to build. This in conjunction with patches of clear cutting and conifer monocultures. All that and other things have contributed to the wildfire situation we have today. 

You're correct that not all Native American practices were sustainable, and I never claimed they are a monolith. However regular prescribed burning as I understand was somewhat common among most if not all western US tribes. Not sure about midwest and eastern tribes/bands. At any rate that burning, which took many forms, was combined with seed spreading, hunting, and horticultural practices to maintain populations over millennia. Some ecosystems and places with high concentrations of biodiversity may not have existed without those practices.",,,1619203891,{},gvlj6dj,False,t3_mwojhi,False,True,t1_gvkoxit,/r/hiking/comments/mwojhi/life_returning_to_wildfire_burn_area_fall_creek/gvlj6dj/,1619219037,1,True,False,hiking,t5_2r9om,,0,[],,
[],,Chronic_Knick,,,[],,,,text,t2_1u4utkm,False,False,[],It’s not that scary if you’re okay with some exposure. There’s a chain link to grab for most of the final section. The worst part is the crowds and dealing with other hikers who can move quite slowly,,,1619203766,{},gvlivup,False,t3_mwwhz6,False,True,t1_gvla8vg,/r/hiking/comments/mwwhz6/celebrated_my_30th_birthday_on_angels_landing_in/gvlivup/,1619218873,3,True,False,hiking,t5_2r9om,,0,[],,
[],,girldepeng,,,[],,,,text,t2_9ljsg,False,False,[],I try to stay in the present. Open up my senses to capture as much as possible.,,,1619203721,{},gvlisc7,False,t3_mx1qoy,False,True,t3_mx1qoy,/r/hiking/comments/mx1qoy/feeling_depressed_during_trips/gvlisc7/,1619218816,2,True,False,hiking,t5_2r9om,,0,[],,
[],,Mounta1anmama,,,[],,,,text,t2_67raj34b,False,False,[],This is Natural Bridges Monument in the SE corner of Utah. A really cool little corner that doesn’t get explored too often and is a hidden gem.,,,1619203366,{},gvli000,True,t3_mx1zy2,False,True,t1_gvlha6v,/r/hiking/comments/mx1zy2/natural_bridges_national_monument/gvli000/,1619218367,2,True,False,hiking,t5_2r9om,,0,[],,
[],,CaminanteNC,,,[],,,,text,t2_1iky93pd,False,False,[],"Man, do I love an inversion.",,,1619203245,{},gvlhq6o,False,t3_mwnmhr,False,True,t3_mwnmhr,/r/hiking/comments/mwnmhr/sunrise_on_the_ampitheatre_in_the_drakensberg/gvlhq6o/,1619218216,1,True,False,hiking,t5_2r9om,,0,[],,
[],,AutoModerator,,,[],,,,text,t2_6l4z3,False,True,[],"
I see you've posted an image.  Thanks for your contribution!

*Did you included the* ***required*** *title information?*  **[Your text.] [Most Specific place], [Specific place], [General place], [COUNTRY].**  
      
If you didn't include this information, please delete your post and resubmit it.  **Your post will be removed without warning if it does not follow this rule!**


*I am a bot, and this action was performed automatically. Please [contact the moderators of this subreddit](/message/compose/?to=/r/hiking) if you have any questions or concerns.*",,,1619203048,{},gvlha6v,False,t3_mx1zy2,False,True,t3_mx1zy2,/r/hiking/comments/mx1zy2/natural_bridges_national_monument/gvlha6v/,1619217968,1,False,False,hiking,t5_2r9om,,0,[],moderator,
[],,Perle1234,,,[],,,,text,t2_3t556ma4,False,True,[],"Oh please. This isn’t about politics. Its about people being dumbasses. Protests aren’t occurring in places where parks are being trashed with litter, and archeological and culturally significant sites being vandalized. I’m in Wyoming, and the surroundings I see it happening to in Idaho,Utah, Colorado, Nebraska and the Dakotas are not engaged in protests in the remote areas of natural beauty. It’s people not knowing/caring how to conduct themselves while camping or spending time in nature. The dumbass climber in Utah who secured bolts on a petroglyph wall in Moab wasn’t protesting.",,,1619202756,{},gvlgmoy,False,t3_mwmwl9,False,False,t1_gvji2lr,/r/hiking/comments/mwmwl9/one_of_my_favorite_local_trails_was_recently/gvlgmoy/,1619217612,2,True,False,hiking,t5_2r9om,,0,[],,
[],,nothisTrophyWife,,,[],,,,text,t2_4t1bi2em,False,False,[],"Towards the end, I start feeling sad that it’s going to be over soon.",,,1619202441,{},gvlfxdw,False,t3_mx1qoy,False,False,t3_mx1qoy,/r/hiking/comments/mx1qoy/feeling_depressed_during_trips/gvlfxdw/,1619217227,3,True,False,hiking,t5_2r9om,,0,[],,
[],,r252a_189,,,[],,,,text,t2_1qsiogu,False,False,[],"I use Darn Tough, I have the athletic kind (thinner than the regular hiking ones) for when it’s hot.

Avoid cotton, they retain sweat and will lead to blisters.",,,1619202217,{},gvlffc5,False,t3_mwzhpx,False,True,t3_mwzhpx,/r/hiking/comments/mwzhpx/what_would_be_a_good_hiking_sock_for_7580_degree/gvlffc5/,1619216948,2,True,False,hiking,t5_2r9om,,0,[],,
[],,anustickl,,,[],,,,text,t2_3ceyv952,False,False,[],I’ll check them out thanks!,,,1619202173,{},gvlfbn5,True,t3_mwzhpx,False,True,t1_gvlci3p,/r/hiking/comments/mwzhpx/what_would_be_a_good_hiking_sock_for_7580_degree/gvlfbn5/,1619216891,1,True,False,hiking,t5_2r9om,,0,[],,
[],,AutoModerator,,,[],,,,text,t2_6l4z3,False,True,[],"
I see you've posted an image.  Thanks for your contribution!

*Did you included the* ***required*** *title information?*  **[Your text.] [Most Specific place], [Specific place], [General place], [COUNTRY].**  
      
If you didn't include this information, please delete your post and resubmit it.  **Your post will be removed without warning if it does not follow this rule!**


*I am a bot, and this action was performed automatically. Please [contact the moderators of this subreddit](/message/compose/?to=/r/hiking) if you have any questions or concerns.*",,,1619201186,{},gvld2el,False,t3_mx1b5o,False,True,t3_mx1b5o,/r/hiking/comments/mx1b5o/the_less_photographed_side_of_mt_st_helens_makes/gvld2el/,1619215589,1,False,False,hiking,t5_2r9om,,0,[],moderator,
[],,Hikeonanon,,,[],,,,text,t2_9ec8pju5,False,True,[],"If it snows where you are, and you want to buy something for four seasons, then boots make sense. If not, then shoes are usually a good call. It really comes down to fit. If you're going to be in wet areas I'd take a look at Oboz. Best sole in all conditions I've worn and really comfortable. Salomon has some really specific shoes/boots for different conditions too. They can get pricey but if you're not buying in a store, the online gear sites are filled with ""last years model"" and you can save a lot. Just remember that fit and comfort is what it's about. And in a lot of cases you do get what you pay for.",,,1619201025,{},gvlcoxi,False,t3_mwtwp6,False,True,t3_mwtwp6,/r/hiking/comments/mwtwp6/help_with_shoesboots/gvlcoxi/,1619215377,1,True,False,hiking,t5_2r9om,,0,[],,
[],,moldylemonade,,,[],,,,text,t2_6aoznjsd,False,False,[],I really liked REI's light weight coolmax socks: https://www.rei.com/product/165386/rei-co-op-coolmax-ecomade-lightweight-tech-hiking-crew-socks,,,1619200943,{},gvlci3p,False,t3_mwzhpx,False,True,t3_mwzhpx,/r/hiking/comments/mwzhpx/what_would_be_a_good_hiking_sock_for_7580_degree/gvlci3p/,1619215271,1,True,False,hiking,t5_2r9om,,0,[],,
