all_awardings,associated_award,author,author_flair_background_color,author_flair_css_class,author_flair_richtext,author_flair_template_id,author_flair_text,author_flair_text_color,author_flair_type,author_fullname,author_patreon_flair,author_premium,awarders,body,collapsed_because_crowd_control,comment_type,created_utc,gildings,id,is_submitter,link_id,locked,no_follow,parent_id,permalink,retrieved_on,score,send_replies,stickied,subreddit,subreddit_id,top_awarded_type,total_awards_received,treatment_tags,distinguished,author_cakeday
[],,Hike_the_603,,,[],,,,text,t2_8yy3ujec,False,False,[],It's snowing on Mt. Fuji,,,1619108541,{},gvgkjh7,False,t3_mvta7j,False,True,t3_mvta7j,/r/hiking/comments/mvta7j/mt_fuji_from_mt_jimba_tokyo_japan/gvgkjh7/,1619120185,1,True,False,hiking,t5_2r9om,,0,[],,
[],,inimicalamitous,,,[],,,,text,t2_bp4df0d5,False,False,[],Oof **rough** time to head up there,,,1619108199,{},gvgjpnl,False,t3_mvuvjv,False,True,t3_mvuvjv,/r/hiking/comments/mvuvjv/franconia_ridge_loop_april_2021/gvgjpnl/,1619119705,1,True,False,hiking,t5_2r9om,,0,[],,
[],,UniqueUsername82D,,,[],,,,text,t2_3nhhi6dk,False,False,[],"Huh, I thought he was human and dead. Maybe we're thinking different Booker T. Washingtons.",,,1619108189,{},gvgjotl,False,t3_mw4xl8,False,True,t3_mw4xl8,/r/hiking/comments/mw4xl8/booker_t_washington_tennessee/gvgjotl/,1619119692,1,True,False,hiking,t5_2r9om,,0,[],,
[],,k_marksthespot,,,[],,,,text,t2_3h9xbcna,False,True,[],I have done it so many times and literally every time the trail to the lake was closed due to bear activity!,,,1619108178,{},gvgjnvn,True,t3_mvwk05,False,True,t1_gvghllk,/r/hiking/comments/mvwk05/hidden_lake_trail_in_glacier_national_park_mt_usa/gvgjnvn/,1619119676,1,True,False,hiking,t5_2r9om,,0,[],,
[],,Garreaumontagne,,,[],,,,text,t2_awsjhsv6,False,False,[],Wow,,,1619108148,{},gvgjl6i,False,t3_mvtop9,False,False,t3_mvtop9,/r/hiking/comments/mvtop9/spring_is_has_arrived_here_in_the_upstate_of/gvgjl6i/,1619119631,1,True,False,hiking,t5_2r9om,,0,[],,
[],,turt808,,,[],,,,text,t2_269tgrnk,False,False,[],"Thanks, I understand the process as you've described, and watched a few vids to help. I will try it out around our neighborhood to test how it works first with some GPX files. Some of them could use an offline map, but some older family members would just want a printed copy of a trail map.",,,1619107991,{},gvgj7uz,True,t3_mw6i45,False,True,t1_gvgeycq,/r/hiking/comments/mw6i45/how_to_privately_trackrecord_hiking_trails_and/gvgj7uz/,1619119401,1,True,False,hiking,t5_2r9om,,0,[],,
[],,AutoModerator,,,[],,,,text,t2_6l4z3,False,True,[],"
I see you've posted an image.  Thanks for your contribution!

*Did you included the* ***required*** *title information?*  **[Your text.] [Most Specific place], [Specific place], [General place], [COUNTRY].**  
      
If you didn't include this information, please delete your post and resubmit it.  **Your post will be removed without warning if it does not follow this rule!**


*I am a bot, and this action was performed automatically. Please [contact the moderators of this subreddit](/message/compose/?to=/r/hiking) if you have any questions or concerns.*",,,1619107825,{},gvgitnb,False,t3_mw8851,False,True,t3_mw8851,/r/hiking/comments/mw8851/some_earth_day_art_for_you_folks/gvgitnb/,1619119165,1,False,False,hiking,t5_2r9om,,0,[],moderator,
[],,G00dSh0tJans0n,,,[],,,,text,t2_6kvp0mwq,False,False,[],Gaia GPS pro subscription and you never have to worry about anything else,,,1619107791,{},gvgiqps,False,t3_mw6i45,False,True,t3_mw6i45,/r/hiking/comments/mw6i45/how_to_privately_trackrecord_hiking_trails_and/gvgiqps/,1619119116,2,True,False,hiking,t5_2r9om,,0,[],,
[],,ImLivingAmongYou,,,[],,,,text,t2_eui63,False,False,[],"Hey, everyone! Happy Earth Day!

Are you looking for ways to help make the Earth a little cleaner and a little better?

You should check out [/r/ZeroWaste](https://np.reddit.com/r/zerowaste)!

We’ve been hosting a weekly challenge for reducing your environmental impact since November of last year! And this week, we’re celebrating Earth Day with a challenge to pick up trash and share your results! Are you up to the challenge?

If you’re looking for doing even more, [you can also check out our wiki for a more comprehensive guide.](https://np.reddit.com/r/ZeroWaste/wiki/index)",,,1619107676,{},gvgigwa,False,t3_mw81vz,False,True,t3_mw81vz,/r/hiking/comments/mw81vz/happy_earth_day_from_colorado/gvgigwa/,1619118948,5,True,False,hiking,t5_2r9om,,0,[],,
[],,Norcalnappy,,,[],,,,text,t2_a6wau,False,False,[],"Nice one! Lots of good hikes and trails all around up here, none are ever really crowded besides Robert Louis. Pretty untraveled part of Nor Cal!",,,1619107407,{},gvghtx4,False,t3_mvvhim,False,True,t1_gvfnxs3,/r/hiking/comments/mvvhim/just_moved_to_an_area_with_amazing_trails/gvghtx4/,1619118562,1,True,False,hiking,t5_2r9om,,0,[],,
[],,Longjumping_Glove_15,,,[],,,,text,t2_a14gigks,False,False,[],Beautiful hike indeed! They closed the trail down to the lake due to grizzly activity but was able to go up to the overlook. Summer 2018,,,1619107308,{},gvghllk,False,t3_mvwk05,False,True,t1_gvenb2z,/r/hiking/comments/mvwk05/hidden_lake_trail_in_glacier_national_park_mt_usa/gvghllk/,1619118420,2,True,False,hiking,t5_2r9om,,0,[],,
[],,AutoModerator,,,[],,,,text,t2_6l4z3,False,True,[],"
I see you've posted an image.  Thanks for your contribution!

*Did you included the* ***required*** *title information?*  **[Your text.] [Most Specific place], [Specific place], [General place], [COUNTRY].**  
      
If you didn't include this information, please delete your post and resubmit it.  **Your post will be removed without warning if it does not follow this rule!**


*I am a bot, and this action was performed automatically. Please [contact the moderators of this subreddit](/message/compose/?to=/r/hiking) if you have any questions or concerns.*",,,1619107290,{},gvghk2k,False,t3_mw80se,False,False,t3_mw80se,/r/hiking/comments/mw80se/mist_in_the_adirondacks_ny_usa/gvghk2k/,1619118395,1,False,False,hiking,t5_2r9om,,0,[],moderator,
[],,Apprehensive_Key_103,,,[],,,,text,t2_3i6eonot,False,False,[],"I have hiked all over the world, but this remains one of my favorites",,,1619106212,{},gvgezcn,False,t3_mvuvjv,False,True,t3_mvuvjv,/r/hiking/comments/mvuvjv/franconia_ridge_loop_april_2021/gvgezcn/,1619116871,2,True,False,hiking,t5_2r9om,,0,[],,
[],,chris457,,,[],,,,text,t2_4by5f,False,False,[],"I use OSMAnd, I think it's probably worth paying the couple dollars a month for when you're using it.  It lets you download topo maps of the area then so you can see you route on the map as you're tracking (without needing cell service). 

Tutorial would be something like ""importing GPX file to google earth"".  But the gist is, track using app, it will record to a GPX file.  Find GPX file on your phone (or share from app if you can).  Transfer to computer.  Open with Google earth.  Or I think you can get it into ""google my maps"" too.  

Lots of apps can open a GPX file.  Including the app you used to track it so you could get your friends to download OSMAnd as well, or one of the other offline navigation apps, share your GPX route with them, and they will be able to see the route and follow it on an offline topo map on their phones.

If you google GPX tracking hiking you'll likely find a lot of info.",,,1619106201,{},gvgeycq,False,t3_mw6i45,False,True,t1_gvgbn7q,/r/hiking/comments/mw6i45/how_to_privately_trackrecord_hiking_trails_and/gvgeycq/,1619116856,1,True,False,hiking,t5_2r9om,,0,[],,
[],,[deleted],,,,,,dark,,,,,[],[deleted],,,1619105925,{},gvgeaxh,False,t3_mw4qk4,False,True,t3_mw4qk4,/r/hiking/comments/mw4qk4/south_africa_the_2_pictures_are_2_sides_of_the/gvgeaxh/,1619116486,1,True,False,hiking,t5_2r9om,,0,[],,
[],,k_marksthespot,,,[],,,,text,t2_3h9xbcna,False,True,[],Thank you!,,,1619105886,{},gvge7h4,True,t3_mv9mgr,False,True,t1_gvfuiiv,/r/hiking/comments/mv9mgr/hilltop_trail_at_sunset_in_mount_diablo_state/gvge7h4/,1619116431,1,True,False,hiking,t5_2r9om,,0,[],,
[],,Keith_Flaskins,,,[],,,,text,t2_3ixq0g1,False,False,[],thinking about proposing to my girlfriend here whilst we are in the area next week. Would you say the spot you took the video from is pretty much what I should be aiming for? Looking for the best backdrop but dont know what you were standing on here. Thanks for any help!,,,1619105816,{},gvge1cx,False,t3_mtzf3p,False,True,t3_mtzf3p,/r/hiking/comments/mtzf3p/whitewater_falls_in_north_carolina_this_sight/gvge1cx/,1619116332,1,True,False,hiking,t5_2r9om,,0,[],,
[],,suddenlyic,,,[],,,,text,t2_me6zaeu,False,False,[],"Does anyone ever struggle to start a fire when you have a saw, an axe, a barbecue grill and a device to create sparks (or just a lighter) under perfectly dry conditions with an abundance of wood in all shapes and sizes?",,,1619105746,{},gvgdvd1,False,t3_mw6jrn,False,True,t3_mw6jrn,/r/hiking/comments/mw6jrn/making_a_fire_the_easy_way/gvgdvd1/,1619116235,2,True,False,hiking,t5_2r9om,,0,[],,
[],,CaminanteNC,,,[],,,,text,t2_1iky93pd,False,False,[],"Man, do I love an inversion.",,,1619105394,{},gvgd1f2,False,t3_mw6qoi,False,False,t3_mw6qoi,/r/hiking/comments/mw6qoi/hewed_appenzell/gvgd1f2/,1619115726,5,True,False,hiking,t5_2r9om,,0,[],,
[],,turt808,,,[],,,,text,t2_269tgrnk,False,False,[],"Thank you! Do you recommend any of these apps over the others, like for my specific purpose that I should start with, and can be done with the free app version?

Is it easy to export/view in google earth? I will try to find a video tutorial/example to go by.",,,1619104809,{},gvgbn7q,True,t3_mw6i45,False,False,t1_gvg8fj8,/r/hiking/comments/mw6i45/how_to_privately_trackrecord_hiking_trails_and/gvgbn7q/,1619114880,1,True,False,hiking,t5_2r9om,,0,[],,
[],,emackd7,,,[],,,,text,t2_bcu7nawi,False,True,[],Wow!,,,1619104462,{},gvgasva,False,t3_mvuvjv,False,True,t3_mvuvjv,/r/hiking/comments/mvuvjv/franconia_ridge_loop_april_2021/gvgasva/,1619114374,1,True,False,hiking,t5_2r9om,,0,[],,
[],,Independent_Ad5919,,,[],,,,text,t2_am07r09i,False,False,[],reminds me of this band called hallas,,,1619104134,{},gvga1dr,False,t3_mvne91,False,False,t3_mvne91,/r/hiking/comments/mvne91/hiking_with_family_in_lares_trek_cusco_peru/gvga1dr/,1619113931,1,True,False,hiking,t5_2r9om,,0,[],,
[],,thewickedbarnacle,,,[],,,,text,t2_4bvw21nu,False,False,[],It should be a psa of how to not go to joshua tree,,,1619104124,{},gvga0le,False,t3_mw4xh5,False,True,t1_gvg8gfp,/r/hiking/comments/mw4xh5/amateur_hikers_get_lost_in_joshua_tree_national/gvga0le/,1619113918,1,True,False,hiking,t5_2r9om,,0,[],,
[],,Singtothering,,,[],,,,text,t2_zanx7g9,False,False,[],Mountains views are awesome and it’s even better with the ocean in the distance.,,,1619103554,{},gvg8p7q,False,t3_mw4qk4,False,True,t3_mw4qk4,/r/hiking/comments/mw4qk4/south_africa_the_2_pictures_are_2_sides_of_the/gvg8p7q/,1619113153,2,True,False,hiking,t5_2r9om,,0,[],,
[],,Cosmic__Cowboy,,,[],,,,text,t2_wxegk,False,False,[],Nearly freezing here in SC this morning,,,1619103506,{},gvg8l5o,False,t3_mvtop9,False,True,t1_gvfcf0m,/r/hiking/comments/mvtop9/spring_is_has_arrived_here_in_the_upstate_of/gvg8l5o/,1619113088,1,True,False,hiking,t5_2r9om,,0,[],,
[],,Find_A_Reason,,,[],,,,text,t2_8xgen7zg,False,False,[],"I don't see anything about getting anything lost at all. Just a guy being a jerk and calling his girlfriend a dumb botch.

Not sure what that adds to the community.",,,1619103450,{},gvg8gfp,False,t3_mw4xh5,False,True,t3_mw4xh5,/r/hiking/comments/mw4xh5/amateur_hikers_get_lost_in_joshua_tree_national/gvg8gfp/,1619113010,3,True,False,hiking,t5_2r9om,,0,[],,
[],,chris457,,,[],,,,text,t2_4by5f,False,False,[],"Strava (turn off public sharing), Gaia, OSMAnd, CalTopo and others are all apps that will track your route to a locally stored GPX file using your phone's GPS.  You can see the route in those apps on a map and you can also export and view in Google earth.",,,1619103439,{},gvg8fj8,False,t3_mw6i45,False,True,t3_mw6i45,/r/hiking/comments/mw6i45/how_to_privately_trackrecord_hiking_trails_and/gvg8fj8/,1619112994,1,True,False,hiking,t5_2r9om,,0,[],,
[],,GeoffB94,,,[],,,,text,t2_a4r2qvf,False,True,[],"That’s really interesting! For context the air temperature here was around +10°C, we hadn’t had any significant rain for five or six days though the lower parts, off the rocky plateau, were still a little boggy.",,,1619103276,{},gvg81op,True,t3_mvjhoi,False,True,t1_gvfyqr2,/r/hiking/comments/mvjhoi/meall_fuarmhonaidh_looking_towards_loch_ness_and/gvg81op/,1619112759,1,True,False,hiking,t5_2r9om,,0,[],,
[],,dbkenny426,,,[],,,,text,t2_3s6yt9p1,False,False,[],One of my favorite places I've ever been. Hoping to go back soon.,,,1619102578,{},gvg6eyq,False,t3_mvtmmq,False,True,t3_mvtmmq,/r/hiking/comments/mvtmmq/the_wilderness_is_slowly_starting_to_come_alive/gvg6eyq/,1619111745,2,True,False,hiking,t5_2r9om,,0,[],,
[],,RondoTheBONEbarian,,,[],,,,text,t2_17brv0,False,False,[],"Gorgeous country up there.


Some cool history about the area. 

https://www.fs.usda.gov/Internet/FSE_DOCUMENTS/fseprd499732.pdf",,,1619102519,{},gvg6a6u,False,t3_mvmqku,False,True,t1_gvg2eq2,/r/hiking/comments/mvmqku/springtime_on_the_kings_river_trail_sierra_nevada/gvg6a6u/,1619111661,2,True,False,hiking,t5_2r9om,,0,[],,
[],,mastersizer3000,,,[],,,,text,t2_137m7zse,False,False,[],Yup! This was taken a couple of miles before Spring Creek.,,,1619100805,{},gvg2eq2,True,t3_mvmqku,False,True,t1_gvf1u4o,/r/hiking/comments/mvmqku/springtime_on_the_kings_river_trail_sierra_nevada/gvg2eq2/,1619109341,1,True,False,hiking,t5_2r9om,,0,[],,
[],,Ralph82R,,,[],,,,text,t2_5nmtsuzk,False,True,[],"Only face, where trail?",,,1619100314,{},gvg1cj7,False,t3_mvvhim,False,True,t3_mvvhim,/r/hiking/comments/mvvhim/just_moved_to_an_area_with_amazing_trails/gvg1cj7/,1619108691,1,True,False,hiking,t5_2r9om,,0,[],,
[],,d_crumbbes,,,[],,,,text,t2_9g9ec4n1,False,False,[],That is a great hike! I'd have thought there'd be more snow up there still though. How muddy were the trails?,,,1619099355,{},gvfzb8u,False,t3_mvuvjv,False,True,t3_mvuvjv,/r/hiking/comments/mvuvjv/franconia_ridge_loop_april_2021/gvfzb8u/,1619107435,1,True,False,hiking,t5_2r9om,,0,[],,
[],,jonesytheman92,,,[],,,,text,t2_2rm8iqoa,False,False,[],Took a trip to Greenville last weekend and was amazed at how green everything was already compared to northern Virginia. I was not enthused by the amount of pollen everywhere though,,,1619099081,{},gvfyqsk,False,t3_mvtop9,False,False,t3_mvtop9,/r/hiking/comments/mvtop9/spring_is_has_arrived_here_in_the_upstate_of/gvfyqsk/,1619107098,1,True,False,hiking,t5_2r9om,,0,[],,
[],,Appropriate-Clue2894,,,[],,,,text,t2_a3grotks,False,False,[],"What is kind of weird is that, at least superficially, the landscape in the photo looks a lot like the landscape of far NW Nevada and far NE California where I hike in the intermediate elevations of the desert when the higher mountains are deep in snow.  Enough that it would take close looking to distinguish photos of one from the other.   Yet climate and precipitation amounts are doubtless very different.",,,1619099081,{},gvfyqr2,False,t3_mvjhoi,False,True,t3_mvjhoi,/r/hiking/comments/mvjhoi/meall_fuarmhonaidh_looking_towards_loch_ness_and/gvfyqr2/,1619107097,1,True,False,hiking,t5_2r9om,,0,[],,
[],,TheShadyGuy,,,[],,,,text,t2_dgz4u,False,False,[],"Of course they are amateurs, not many hiking companies out there paying people to hike...",,,1619099077,{},gvfyqfy,False,t3_mw4xh5,False,False,t3_mw4xh5,/r/hiking/comments/mw4xh5/amateur_hikers_get_lost_in_joshua_tree_national/gvfyqfy/,1619107092,5,True,False,hiking,t5_2r9om,,0,[],,
[],,AutoModerator,,,[],,,,text,t2_6l4z3,False,True,[],"
I see you've posted an image.  Thanks for your contribution!

*Did you included the* ***required*** *title information?*  **[Your text.] [Most Specific place], [Specific place], [General place], [COUNTRY].**  
      
If you didn't include this information, please delete your post and resubmit it.  **Your post will be removed without warning if it does not follow this rule!**


*I am a bot, and this action was performed automatically. Please [contact the moderators of this subreddit](/message/compose/?to=/r/hiking) if you have any questions or concerns.*",,,1619098208,{},gvfwzpz,False,t3_mw4ry3,False,True,t3_mw4ry3,/r/hiking/comments/mw4ry3/right_before_my_phone_fell_in_the_water_at/gvfwzpz/,1619106042,1,False,False,hiking,t5_2r9om,,0,[],moderator,
[],,mystic-boer,,,[],,,,text,t2_68xiq39s,False,False,[],"If it looks like this in the US I will have to come check it out. This is on public land high up where no one sleeps, so pitching wherever is fine and safe, is it possible to camp like this that side?",,,1619097845,{},gvfw9zg,True,t3_mplrpp,False,True,t1_gv8zrcw,/r/hiking/comments/mplrpp/lovely_friday/gvfw9zg/,1619105599,1,True,False,hiking,t5_2r9om,,0,[],,
[],,Wienckowski,,,[],,,,text,t2_8q6qs8ee,False,False,[],I want so much to visit Hong Kong someday,,,1619097514,{},gvfvmka,False,t3_mvzb9z,False,True,t3_mvzb9z,/r/hiking/comments/mvzb9z/hiking_in_tai_long_wan_sai_kung_east_country_park/gvfvmka/,1619105204,2,True,False,hiking,t5_2r9om,,0,[],,
[],,Responsible_Suspect5,,,[],,,,text,t2_8teyga9c,False,False,[],"I think the best advice is to do a short trip or two before heading out...that way you will learn a lot about what you need and the kind of physical shape you are in. As well, you will get an idea of essential and non-essential equipment. Don't forget a medical bag with basic supplies.",,,1619097070,{},gvfus8g,False,t3_mvmzki,False,True,t3_mvmzki,/r/hiking/comments/mvmzki/im_going_on_a_trip_and_im_not_sure_how_to_prepare/gvfus8g/,1619104694,1,True,False,hiking,t5_2r9om,,0,[],,
[],,TinButtFlute,,,[],,,,text,t2_3jfyw12c,False,False,[],"Yes, but I can't speak to how well it works.  I mostly use it just for bringing up trail maps before heading out on small day hikes.  And maybe checking my position when encountering an unexpected intersection.",,,1619096943,{},gvfujpe,False,t3_mv6xn0,False,False,t1_gvfj6af,/r/hiking/comments/mv6xn0/does_anyone_else_hate_the_ui_on_all_trails/gvfujpe/,1619104549,1,True,False,hiking,t5_2r9om,,0,[],,
[],,Responsible_Suspect5,,,[],,,,text,t2_8teyga9c,False,False,[],Absolutely gorgeous.,,,1619096925,{},gvfuiiv,False,t3_mv9mgr,False,True,t3_mv9mgr,/r/hiking/comments/mv9mgr/hilltop_trail_at_sunset_in_mount_diablo_state/gvfuiiv/,1619104527,1,True,False,hiking,t5_2r9om,,0,[],,
[],,AutoModerator,,,[],,,,text,t2_6l4z3,False,True,[],"
I see you've posted an image.  Thanks for your contribution!

*Did you included the* ***required*** *title information?*  **[Your text.] [Most Specific place], [Specific place], [General place], [COUNTRY].**  
      
If you didn't include this information, please delete your post and resubmit it.  **Your post will be removed without warning if it does not follow this rule!**


*I am a bot, and this action was performed automatically. Please [contact the moderators of this subreddit](/message/compose/?to=/r/hiking) if you have any questions or concerns.*",,,1619096877,{},gvfufee,False,t3_mw4c8i,False,True,t3_mw4c8i,/r/hiking/comments/mw4c8i/trail_tracing_himachal_pradesh_bharat/gvfufee/,1619104471,1,False,False,hiking,t5_2r9om,,0,[],moderator,
[],,Responsible_Suspect5,,,[],,,,text,t2_8teyga9c,False,False,[],"Wow, that's a great shot.",,,1619096747,{},gvfu6mp,False,t3_mvtcqy,False,True,t3_mvtcqy,/r/hiking/comments/mvtcqy/eagles_nest_red_river_gorge_ky/gvfu6mp/,1619104321,1,True,False,hiking,t5_2r9om,,0,[],,
[],,JammyJacketPotato,,,[],,,,text,t2_6dsrok2t,False,False,[],Gorgeous!,,,1619096554,{},gvfttom,False,t3_mvvhim,False,True,t3_mvvhim,/r/hiking/comments/mvvhim/just_moved_to_an_area_with_amazing_trails/gvfttom/,1619104097,1,True,False,hiking,t5_2r9om,,0,[],,
[],,spychipper,,,[],,,,text,t2_3uaaj,False,False,[],"A coat of clear, matte polyurethane and a rubber chair tip from a hardware store on the end will make it last a lot longer. I usually just use a bit of gorillia glue on the end, but not the sides to hold the tip on, pressure will force the glue up the sides. 

[This is with a light colored stain](https://i.imgur.com/qMshVvQ.jpg) if you wanted color, but that picture is of one made with Magnolia which is an almost white color unfinished, yours would be darker.

[This is a more normal color stain](https://i.imgur.com/d2qFGoI.jpg) but unknown wood, it was felled by a beaver and left lying, the channels are from bug activity, it's generally called [wormwoord](https://www.google.com/search?q=wormwood+wood&amp;safe=active&amp;rlz=1C1GCEU_enUS876US876&amp;sxsrf=ALeKk00hL9OSDpRl2fYwBbt6RR6FnRvMNg:1619095573573&amp;source=lnms&amp;tbm=isch&amp;sa=X&amp;ved=2ahUKEwijlZSE8ZHwAhUIKuwKHR4dD0wQ_AUoAnoECAEQBA&amp;biw=1661&amp;bih=873).",,,1619095688,{},gvfs8s2,False,t3_mvvhim,False,True,t1_gvfqi0z,/r/hiking/comments/mvvhim/just_moved_to_an_area_with_amazing_trails/gvfs8s2/,1619103166,2,True,False,hiking,t5_2r9om,,0,[],,
[],,PedroCollector,,,[],,,,text,t2_3ukcfmlb,False,False,[],"Yeah, it's such a gorgeous place.  I want to go one day in the early morning",,,1619095038,{},gvfr43b,True,t3_mvvhim,False,True,t1_gvfq7pe,/r/hiking/comments/mvvhim/just_moved_to_an_area_with_amazing_trails/gvfr43b/,1619102511,1,True,False,hiking,t5_2r9om,,0,[],,
[],,PedroCollector,,,[],,,,text,t2_3ukcfmlb,False,False,[],Thanks.  Sanded oak from a tree that fell near my house,,,1619094674,{},gvfqi0z,True,t3_mvvhim,False,True,t1_gvfpedo,/r/hiking/comments/mvvhim/just_moved_to_an_area_with_amazing_trails/gvfqi0z/,1619102146,1,True,False,hiking,t5_2r9om,,0,[],,
[],,She_reese,,,[],,,,text,t2_8w0jl59i,False,False,[],Waterfall hikes are the best!,,,1619094502,{},gvfq7pe,False,t3_mvvhim,False,True,t3_mvvhim,/r/hiking/comments/mvvhim/just_moved_to_an_area_with_amazing_trails/gvfq7pe/,1619101971,2,True,False,hiking,t5_2r9om,,0,[],,
[],,AutoModerator,,,[],,,,text,t2_6l4z3,False,True,[],"
I see you've posted an image.  Thanks for your contribution!

*Did you included the* ***required*** *title information?*  **[Your text.] [Most Specific place], [Specific place], [General place], [COUNTRY].**  
      
If you didn't include this information, please delete your post and resubmit it.  **Your post will be removed without warning if it does not follow this rule!**


*I am a bot, and this action was performed automatically. Please [contact the moderators of this subreddit](/message/compose/?to=/r/hiking) if you have any questions or concerns.*",,,1619094282,{},gvfpuyz,False,t3_mw3kwa,False,True,t3_mw3kwa,/r/hiking/comments/mw3kwa/ullswater_lake_district_uk/gvfpuyz/,1619101756,1,False,False,hiking,t5_2r9om,,0,[],moderator,
[],,yellowearbuds,,,[],,,,text,t2_8lqwngr4,False,False,[],That is some nice wood you're holding.,,,1619094003,{},gvfpedo,False,t3_mvvhim,False,True,t3_mvvhim,/r/hiking/comments/mvvhim/just_moved_to_an_area_with_amazing_trails/gvfpedo/,1619101480,1,True,False,hiking,t5_2r9om,,0,[],,
[],,MrJoshyJosh,,,[],,,,text,t2_5fn0pylz,False,False,[],"So, how many Pedros have you collected?

Beautiful waterfall, by the way.",,,1619093649,{},gvfottg,False,t3_mvvhim,False,True,t3_mvvhim,/r/hiking/comments/mvvhim/just_moved_to_an_area_with_amazing_trails/gvfottg/,1619101140,1,True,False,hiking,t5_2r9om,,0,[],,
[],,PedroCollector,,,[],,,,text,t2_3ukcfmlb,False,False,[],They are,,,1619093070,{},gvfnxs3,True,t3_mvvhim,False,True,t1_gvenb5b,/r/hiking/comments/mvvhim/just_moved_to_an_area_with_amazing_trails/gvfnxs3/,1619100603,2,True,False,hiking,t5_2r9om,,0,[],,
[],,PedroCollector,,,[],,,,text,t2_3ukcfmlb,False,False,[],That's a very good question.  I have no idea,,,1619093049,{},gvfnwmb,True,t3_mvvhim,False,True,t1_gvfajo0,/r/hiking/comments/mvvhim/just_moved_to_an_area_with_amazing_trails/gvfnwmb/,1619100583,1,True,False,hiking,t5_2r9om,,0,[],,
[],,PedroCollector,,,[],,,,text,t2_3ukcfmlb,False,False,[],"Cobb, CA.  Socrates falls",,,1619092996,{},gvfntly,True,t3_mvvhim,False,True,t1_gvekkse,/r/hiking/comments/mvvhim/just_moved_to_an_area_with_amazing_trails/gvfntly/,1619100531,3,True,False,hiking,t5_2r9om,,0,[],,
[],,Serioussandy,,,[],,,,text,t2_aedaobhh,False,False,[],Beautiful!,,,1619091607,{},gvflsn6,False,t3_mvvhim,False,True,t3_mvvhim,/r/hiking/comments/mvvhim/just_moved_to_an_area_with_amazing_trails/gvflsn6/,1619099359,1,True,False,hiking,t5_2r9om,,0,[],,
[],,hunterminator14,,,[],,,,text,t2_ybke66d,False,False,[],Picture #1 is similar to my experience. We couldn't see farther than than 15 feet. Thought we were going to die.. best hike I have ever been on. Love me the Pemi Loop,,,1619091584,{},gvflrj7,False,t3_mvuvjv,False,True,t3_mvuvjv,/r/hiking/comments/mvuvjv/franconia_ridge_loop_april_2021/gvflrj7/,1619099341,1,True,False,hiking,t5_2r9om,,0,[],,
[],,slinkyslinger,,,[],,,,text,t2_12vz2r,False,False,[],Much thanks,,,1619089790,{},gvfjboi,True,t3_mv6xn0,False,True,t1_gvaghc9,/r/hiking/comments/mv6xn0/does_anyone_else_hate_the_ui_on_all_trails/gvfjboi/,1619097903,1,True,False,hiking,t5_2r9om,,0,[],,
[],,slinkyslinger,,,[],,,,text,t2_12vz2r,False,False,[],Yeah being able to download the maps is key,,,1619089780,{},gvfjb8l,True,t3_mv6xn0,False,True,t1_gvcfsef,/r/hiking/comments/mv6xn0/does_anyone_else_hate_the_ui_on_all_trails/gvfjb8l/,1619097896,1,True,False,hiking,t5_2r9om,,0,[],,
[],,slinkyslinger,,,[],,,,text,t2_12vz2r,False,False,[],Sounds like this is exactly what I want.  I'm hoping for somthing with more technical data and features!  Give me all the stats!,,,1619089735,{},gvfj97b,True,t3_mv6xn0,False,True,t1_gva9ht6,/r/hiking/comments/mv6xn0/does_anyone_else_hate_the_ui_on_all_trails/gvfj97b/,1619097861,1,True,False,hiking,t5_2r9om,,0,[],,
[],,slinkyslinger,,,[],,,,text,t2_12vz2r,False,False,[],Can it do route planning as well?,,,1619089672,{},gvfj6af,True,t3_mv6xn0,False,True,t1_gva9bzv,/r/hiking/comments/mv6xn0/does_anyone_else_hate_the_ui_on_all_trails/gvfj6af/,1619097809,1,True,False,hiking,t5_2r9om,,0,[],,
