all_awardings,associated_award,author,author_flair_background_color,author_flair_css_class,author_flair_richtext,author_flair_template_id,author_flair_text,author_flair_text_color,author_flair_type,author_fullname,author_patreon_flair,author_premium,awarders,body,collapsed_because_crowd_control,comment_type,created_utc,gildings,id,is_submitter,link_id,locked,no_follow,parent_id,permalink,retrieved_on,score,send_replies,stickied,subreddit,subreddit_id,top_awarded_type,total_awards_received,treatment_tags,distinguished,author_cakeday
[],,bailey757,,,[],,,,text,t2_6drvc,False,False,[],"I used to live on the other side too. Fly on over! Or better yet, drive",,,1618953054,{},gv9071b,True,t3_mus6cq,False,False,t1_gv8zhlu,/r/hiking/comments/mus6cq/a_bluebird_day_at_mt_st_helens_washington_usa/gv9071b/,1618965167,3,True,False,hiking,t5_2r9om,,0,[],,
[],,bailey757,,,[],,,,text,t2_6drvc,False,False,[],I was covered up head to toe. Pale skin probs,,,1618953015,{},gv903oe,True,t3_mus6cq,False,True,t1_gv8y86x,/r/hiking/comments/mus6cq/a_bluebird_day_at_mt_st_helens_washington_usa/gv903oe/,1618965116,1,True,False,hiking,t5_2r9om,,0,[],,
[],,melyssagh,,,[],,,,text,t2_3ovttll8,False,False,[],"It’s not the same region, but it’s quite close though!",,,1618952932,{},gv8zwvw,True,t3_mufyzd,False,True,t1_gv73e6n,/r/hiking/comments/mufyzd/mont_du_dôme_charlevoix_québec_canada/gv8zwvw/,1618965011,1,True,False,hiking,t5_2r9om,,0,[],,
[],,bailey757,,,[],,,,text,t2_6drvc,False,False,[],"My only other time was in late September- so technically fall, but it had gotten a fresh snowfall. I got to experience a little bit of the ash/shale and I'd say hiking on snow is a hel of a lot easier. Also less dusty/dirty.

With the ash, you can't really give yourself extra traction whereas climbing on snow with microspikes or crampons, you can make steady forward progress without any backsliding",,,1618952927,{},gv8zwfp,True,t3_mus6cq,False,True,t1_gv8xrrv,/r/hiking/comments/mus6cq/a_bluebird_day_at_mt_st_helens_washington_usa/gv8zwfp/,1618965004,2,True,False,hiking,t5_2r9om,,0,[],,
[],,ZRR28,,,[],,,,text,t2_4eq7h2fq,False,False,[],Lol yeah just missed.,,,1618952867,{},gv8zrcw,False,t3_mplrpp,False,True,t1_gv8z8xi,/r/hiking/comments/mplrpp/lovely_friday/gv8zrcw/,1618964926,2,True,False,hiking,t5_2r9om,,0,[],,
[],,marymoonwalker,,,[],,,,text,t2_ayacnk62,False,False,[],"Stunning photos, wow.",,,1618952866,{},gv8zrbu,False,t3_mus6cq,False,True,t3_mus6cq,/r/hiking/comments/mus6cq/a_bluebird_day_at_mt_st_helens_washington_usa/gv8zrbu/,1618964926,1,True,False,hiking,t5_2r9om,,0,[],,
[],,bailey757,,,[],,,,text,t2_6drvc,False,False,[],"West coast mountains are much more dramatic-looking, that's for sure",,,1618952824,{},gv8znq7,True,t3_mus6cq,False,True,t1_gv88nrj,/r/hiking/comments/mus6cq/a_bluebird_day_at_mt_st_helens_washington_usa/gv8znq7/,1618964871,2,True,False,hiking,t5_2r9om,,0,[],,
[],,bailey757,,,[],,,,text,t2_6drvc,False,False,[],False summit is soulsucking,,,1618952790,{},gv8zkz9,True,t3_mus6cq,False,True,t1_gv8wa7q,/r/hiking/comments/mus6cq/a_bluebird_day_at_mt_st_helens_washington_usa/gv8zkz9/,1618964828,1,True,False,hiking,t5_2r9om,,0,[],,
[],,[deleted],,,,,,dark,,,,,[],[removed],,,1618952759,{},gv8zii1,False,t3_muzq12,False,True,t3_muzq12,/r/hiking/comments/muzq12/wish_once_i_will_be_there_in_the_united_states/gv8zii1/,1618964788,1,True,False,hiking,t5_2r9om,,0,[],,
[],,IndyAJD,,,[],,,,text,t2_m45e8,False,False,[],"How am I supposed to go about my life normally with the knowledge that this place and my own state are technically part of the same country, I just live on the boring side",,,1618952748,{},gv8zhlu,False,t3_mus6cq,False,True,t3_mus6cq,/r/hiking/comments/mus6cq/a_bluebird_day_at_mt_st_helens_washington_usa/gv8zhlu/,1618964774,3,True,False,hiking,t5_2r9om,,0,[],,
[],,mystic-boer,,,[],,,,text,t2_68xiq39s,False,False,[],South Africa,,,1618952666,{},gv8zalk,True,t3_mplrpp,False,True,t1_gubufzs,/r/hiking/comments/mplrpp/lovely_friday/gv8zalk/,1618964667,1,True,False,hiking,t5_2r9om,,0,[],,
[],,mystic-boer,,,[],,,,text,t2_68xiq39s,False,False,[],Western cape south africa. Close though,,,1618952647,{},gv8z8xi,True,t3_mplrpp,False,True,t1_gubkznp,/r/hiking/comments/mplrpp/lovely_friday/gv8z8xi/,1618964641,1,True,False,hiking,t5_2r9om,,0,[],,
[],,ashfakaziz,,,[],,,,text,t2_aimgf01x,False,False,[],Yes. I wish.,,,1618952303,{},gv8yfu9,True,t3_muzq12,False,True,t1_gv8wl7v,/r/hiking/comments/muzq12/wish_once_i_will_be_there_in_the_united_states/gv8yfu9/,1618964179,0,True,False,hiking,t5_2r9om,,0,[],,
[],,mmm_sweetroll,,,[],,,,text,t2_b5q38c41,False,False,[],This picture just gave me sun poisoning,,,1618952214,{},gv8y86x,False,t3_mus6cq,False,True,t3_mus6cq,/r/hiking/comments/mus6cq/a_bluebird_day_at_mt_st_helens_washington_usa/gv8y86x/,1618964059,1,True,False,hiking,t5_2r9om,,0,[],,
[],,MatrixPA,,,[],,,,text,t2_8tt14,False,False,[],Yes. Yes it is.,,,1618952202,{},gv8y72n,False,t3_mux3pq,False,True,t3_mux3pq,/r/hiking/comments/mux3pq/best_place_on_earth/gv8y72n/,1618964042,1,True,False,hiking,t5_2r9om,,0,[],,
[],,fuzzmcmunn,,,[],,,,text,t2_8rtm6d8,False,False,[],"Jealous!!!!! Well done! 

Can I ask, have you climbed it in summer as well? I’ve only done the summer summits and was planning to start training for bigger ones n winter starting with Helens, but I’m curious as to the difficultly and what changes in shale vs snow?",,,1618952027,{},gv8xrrv,False,t3_mus6cq,False,True,t3_mus6cq,/r/hiking/comments/mus6cq/a_bluebird_day_at_mt_st_helens_washington_usa/gv8xrrv/,1618963807,1,True,False,hiking,t5_2r9om,,0,[],,
[],,thewickedbarnacle,,,[],,,,text,t2_4bvw21nu,False,False,[],Looks like a tough hike,,,1618951543,{},gv8wl7v,False,t3_muzq12,False,False,t3_muzq12,/r/hiking/comments/muzq12/wish_once_i_will_be_there_in_the_united_states/gv8wl7v/,1618963135,3,True,False,hiking,t5_2r9om,,0,[],,
[],,bo_tew,,,[],,,,text,t2_3mo3ig,False,False,[],"I did it last summer, let me know if you need more info. Around 8 miles, I can send you my gpx data. Not too difficult until the last 1/4 mile - that was hell.",,,1618951415,{},gv8wa7q,False,t3_mus6cq,False,True,t1_gv8iyf2,/r/hiking/comments/mus6cq/a_bluebird_day_at_mt_st_helens_washington_usa/gv8wa7q/,1618962961,2,True,False,hiking,t5_2r9om,,0,[],,
[],,AutoModerator,,,[],,,,text,t2_6l4z3,False,True,[],"
I see you've posted an image.  Thanks for your contribution!

*Did you included the* ***required*** *title information?*  **[Your text.] [Most Specific place], [Specific place], [General place], [COUNTRY].**  
      
If you didn't include this information, please delete your post and resubmit it.  **Your post will be removed without warning if it does not follow this rule!**


*I am a bot, and this action was performed automatically. Please [contact the moderators of this subreddit](/message/compose/?to=/r/hiking) if you have any questions or concerns.*",,,1618950872,{},gv8uz8y,False,t3_muzq12,False,True,t3_muzq12,/r/hiking/comments/muzq12/wish_once_i_will_be_there_in_the_united_states/gv8uz8y/,1618962219,1,False,False,hiking,t5_2r9om,,0,[],moderator,
[],,k_marksthespot,,,[],,,,text,t2_3h9xbcna,False,True,[],Mine too! But it’s home so I’m biased here,,,1618950855,{},gv8uxta,True,t3_muggqk,False,True,t1_gv8r5hb,/r/hiking/comments/muggqk/grinnell_lake_overlook_on_grinnell_glacier_trail/gv8uxta/,1618962197,1,True,False,hiking,t5_2r9om,,0,[],,
[],,AutoModerator,,,[],,,,text,t2_6l4z3,False,True,[],"Your post was removed due to your account being new. Please wait until your account is 1 day old before you post again. Or try messaging the moderators for approval.

*I am a bot, and this action was performed automatically. Please [contact the moderators of this subreddit](/message/compose/?to=/r/hiking) if you have any questions or concerns.*",,,1618950623,{},gv8udse,False,t3_muzlo7,False,True,t3_muzlo7,/r/hiking/comments/muzlo7/what_are_your_thoughts_about_this_new_brand/gv8udse/,1618961887,1,False,False,hiking,t5_2r9om,,0,[],moderator,
[],,thegreengumball2,,,[],,,,text,t2_bmlf0xo8,False,True,[],no one hikes there... it is all switch back all the way up... it was nice,,,1618950363,{},gv8trdi,True,t3_mujjsv,False,True,t1_gv6mdk2,/r/hiking/comments/mujjsv/we_call_it_a_poo_with_a_view_10_out_of_10_would/gv8trdi/,1618961536,1,True,False,hiking,t5_2r9om,,0,[],,
[],,Find_A_Reason,,,[],,,,text,t2_8xgen7zg,False,False,[],"They ha e picnic areas in national parks for a reason, use those. Do not go off trail in sensitive areas.

It is also illegal to take any rocks, plants, animal byproducts, etc from national parks, so don't.",,,1618950128,{},gv8t6sj,False,t3_muxpf4,False,True,t3_muxpf4,/r/hiking/comments/muxpf4/what_is_picnic_etiquette_when_hiking/gv8t6sj/,1618961210,1,True,False,hiking,t5_2r9om,,0,[],,
[],,converter-bot,,,[],,,,text,t2_zds627j,False,True,[],5 miles is 8.05 km,,,1618950039,{},gv8sz2u,False,t3_muxpf4,False,True,t1_gv8sy0q,/r/hiking/comments/muxpf4/what_is_picnic_etiquette_when_hiking/gv8sz2u/,1618961092,2,True,False,hiking,t5_2r9om,,0,[],,
[],,Amediumsizedgoose,,,[],,,,text,t2_78u3nju,False,False,[],"If you're aware you and your friends are loud, go out of your way to be quiet on the trail. People that project their voice 5 miles away or use a speaker to play music are jerks. Follow leave no trace and check out the park website beforehand. I also just want to point out that a national park might not be the best place to casually have a picnic. People have to eat on the trail of course, but it's not like a picnic energy. It might be more appropriate and fun to go on a local park hiking trail.",,,1618950026,{},gv8sy0q,False,t3_muxpf4,False,True,t3_muxpf4,/r/hiking/comments/muxpf4/what_is_picnic_etiquette_when_hiking/gv8sy0q/,1618961074,2,True,False,hiking,t5_2r9om,,0,[],,
[],,thegreengumball2,,,[],,,,text,t2_bmlf0xo8,False,True,[],haha,,,1618949931,{},gv8spq1,True,t3_mujjsv,False,True,t1_gv7z3w9,/r/hiking/comments/mujjsv/we_call_it_a_poo_with_a_view_10_out_of_10_would/gv8spq1/,1618960943,1,True,False,hiking,t5_2r9om,,0,[],,
[],,Wolfsangel123,,,[],,,,text,t2_jz2xd,False,False,[],Until a heavy storm at least. :),,,1618949601,{},gv8rx7u,False,t3_mux3pq,False,True,t3_mux3pq,/r/hiking/comments/mux3pq/best_place_on_earth/gv8rx7u/,1618960490,1,True,False,hiking,t5_2r9om,,0,[],,
[],,bigjimnm,,,[],,,,text,t2_gk0ke,False,False,[],"It's more than likely that the north Cascades in the States has 10x the population of BC. Aside from the lower mainland, BC has almost no people. So less people to post about it on Reddit.",,,1618949594,{},gv8rwl2,False,t3_muymni,False,True,t3_muymni,/r/hiking/comments/muymni/question_about_coast_mountain_range_of_bc/gv8rwl2/,1618960480,1,True,False,hiking,t5_2r9om,,0,[],,
[],,chaoticflanagan,,,[],,,,text,t2_42yf7,False,False,[],Loved this hike - one of my favorite National Parks!,,,1618949278,{},gv8r5hb,False,t3_muggqk,False,True,t3_muggqk,/r/hiking/comments/muggqk/grinnell_lake_overlook_on_grinnell_glacier_trail/gv8r5hb/,1618960043,2,True,False,hiking,t5_2r9om,,0,[],,
[],,Practical_Music_4192,,,[],,,,text,t2_4j7hnj6i,False,False,[],"I’m saving for wool base next winter. I can say that wool socks seem to be much better at regulating temp and almost never smell,",,,1618949128,{},gv8qsio,False,t3_muhk7q,False,True,t3_muhk7q,/r/hiking/comments/muhk7q/baselayer_question/gv8qsio/,1618959838,1,True,False,hiking,t5_2r9om,,0,[],,
[],,breezyweezy23,,,[],,,,text,t2_5y3tt9ce,False,False,[],Looks like Yosemite. There is half dome.,,,1618948930,{},gv8qbic,False,t3_mux3pq,False,True,t1_gv8ooaa,/r/hiking/comments/mux3pq/best_place_on_earth/gv8qbic/,1618959561,6,True,False,hiking,t5_2r9om,,0,[],,
[],,ayram3824,,,[],,,,text,t2_13wts0,False,False,[],this a real place? wtf,,,1618948696,{},gv8proa,False,t3_mus6cq,False,True,t3_mus6cq,/r/hiking/comments/mus6cq/a_bluebird_day_at_mt_st_helens_washington_usa/gv8proa/,1618959235,2,True,False,hiking,t5_2r9om,,0,[],,
[],,ck108860,,,[],,,,text,t2_muh3x,False,False,[],Doing it in two weeks!,,,1618948458,{},gv8p7r1,False,t3_mus6cq,False,True,t3_mus6cq,/r/hiking/comments/mus6cq/a_bluebird_day_at_mt_st_helens_washington_usa/gv8p7r1/,1618958912,2,True,False,hiking,t5_2r9om,,0,[],,
[],,Nomics,,,[],,,,text,t2_b8y79,False,False,[],"Not sure which circles your in. While alpinisim isn't popular the hiking makes the front page of reddit fairly often. Garabaldi Park is well known, and of course Whistler. There is also Joffree that gets a lot of attention. 

The one big gap is there are very few well maintained and easily accessed multi day backpacking trips. Lot's of there and back overnighters, but there is a need for more remote trail building to connect numerous trails together.",,,1618948456,{},gv8p7lo,False,t3_muymni,False,False,t3_muymni,/r/hiking/comments/muymni/question_about_coast_mountain_range_of_bc/gv8p7lo/,1618958910,1,True,False,hiking,t5_2r9om,,0,[],,
[],,Drink_Water69,,,[],,,,text,t2_9kc4rjqs,False,False,[],Location ?,,,1618948235,{},gv8ooaa,False,t3_mux3pq,False,True,t3_mux3pq,/r/hiking/comments/mux3pq/best_place_on_earth/gv8ooaa/,1618958597,1,True,False,hiking,t5_2r9om,,0,[],,
[],,211logos,,,[],,,,text,t2_c72lu,False,False,[],"Depends.

On some of the trails in that heavily used park there really aren't a lot of good spots to pull off, like some of the nature trails and trails around the big trees. Often fencing anyway. But on other trails, like Redwood Canyon, or even Crescent Meadow, sure, find a place out of the way of everyone's view etc and you can have a nice picnic. Basically don't hog a public area. 

And BTW, you can't ""hunt rocks"" in a national park if said hunting means collecting.",,,1618947468,{},gv8mvbf,False,t3_muxpf4,False,True,t3_muxpf4,/r/hiking/comments/muxpf4/what_is_picnic_etiquette_when_hiking/gv8mvbf/,1618957555,1,True,False,hiking,t5_2r9om,,0,[],,
[],,bailey757,,,[],,,,text,t2_6drvc,False,False,[],"Yea, Mailbox Old Trail is pretty brutal. Lots of high stepping. I've only taken it down, not up",,,1618947290,{},gv8mg19,True,t3_mus6cq,False,True,t1_gv8lbun,/r/hiking/comments/mus6cq/a_bluebird_day_at_mt_st_helens_washington_usa/gv8mg19/,1618957304,1,True,False,hiking,t5_2r9om,,0,[],,
[],,Temporary_End6007,,,[],,,,text,t2_7qibtgdi,False,False,[],"No.  If there are trails, stay on the trails.",,,1618947134,{},gv8m2ws,False,t3_muxpf4,False,True,t1_gv8irtw,/r/hiking/comments/muxpf4/what_is_picnic_etiquette_when_hiking/gv8m2ws/,1618957086,1,True,False,hiking,t5_2r9om,,0,[],,
[],,Temporary_End6007,,,[],,,,text,t2_7qibtgdi,False,False,[],"Going off trail, even slightly, is a big deal. This is how single track trails end up being 25 feet wide. Stay on the trail even if it is muddy, or icy.  If you don't want to get muddy, run around.",,,1618947094,{},gv8lzfy,False,t3_muxpf4,False,True,t1_gv8j6c5,/r/hiking/comments/muxpf4/what_is_picnic_etiquette_when_hiking/gv8lzfy/,1618957027,1,True,False,hiking,t5_2r9om,,0,[],,
[],,Temporary_End6007,,,[],,,,text,t2_7qibtgdi,False,False,[],"Don't go off trail. Most parks have picnic areas somewhere in them. Use them. 

Don't be loud. People head into nature to get away from the loudness of life. 

Don't litter. Pack out more than you pack in.",,,1618947009,{},gv8ls5h,False,t3_muxpf4,False,True,t3_muxpf4,/r/hiking/comments/muxpf4/what_is_picnic_etiquette_when_hiking/gv8ls5h/,1618956903,3,True,False,hiking,t5_2r9om,,0,[],,
[],,Bobtom42,,,[],,,,text,t2_39gpgye4,False,False,[],"I'd recommend National Forest. If I remember correctly, NF sounds most of Sequoia NP. Google ""leave no trace"".",,,1618946914,{},gv8lk1c,False,t3_muxpf4,False,True,t1_gv8irtw,/r/hiking/comments/muxpf4/what_is_picnic_etiquette_when_hiking/gv8lk1c/,1618956766,1,True,False,hiking,t5_2r9om,,0,[],,
[],,mskofthemilkyway,,,[],,,,text,t2_14r8is,False,False,[],"The Boulder field and up wasn’t bad last time, it was the trail up that killed me. Lots of huge steps/washouts killed my energy.

So excited for this trail!",,,1618946817,{},gv8lbun,False,t3_mus6cq,False,True,t1_gv8i7qf,/r/hiking/comments/mus6cq/a_bluebird_day_at_mt_st_helens_washington_usa/gv8lbun/,1618956626,2,True,False,hiking,t5_2r9om,,0,[],,
[],,uhduhnuh,,,[],,,,text,t2_2ej633ze,False,False,[],"Don't take any souvenirs from the parks apart from pictures and whatever you buy at the gift shop. That includes flowers and rocks. One or two little things might not seem like a big deal, but if you get parks with thousands of visitors every month, each just taking one or two little things, it can add up pretty quick.",,,1618946631,{},gv8kvu9,False,t3_muxpf4,False,True,t3_muxpf4,/r/hiking/comments/muxpf4/what_is_picnic_etiquette_when_hiking/gv8kvu9/,1618956357,3,True,False,hiking,t5_2r9om,,0,[],,
[],,k_marksthespot,,,[],,,,text,t2_3h9xbcna,False,True,[],Oh no! Well hope you can make it back again!,,,1618946430,{},gv8ke8k,True,t3_muggqk,False,True,t1_gv8hqf7,/r/hiking/comments/muggqk/grinnell_lake_overlook_on_grinnell_glacier_trail/gv8ke8k/,1618956058,2,True,False,hiking,t5_2r9om,,0,[],,
[],,k_marksthespot,,,[],,,,text,t2_3h9xbcna,False,True,[],You will see incredible views even if higher elevations aren’t accessible!,,,1618946400,{},gv8kbml,True,t3_muggqk,False,True,t1_gv87r1e,/r/hiking/comments/muggqk/grinnell_lake_overlook_on_grinnell_glacier_trail/gv8kbml/,1618956011,2,True,False,hiking,t5_2r9om,,0,[],,
[],,k_marksthespot,,,[],,,,text,t2_3h9xbcna,False,True,[],Love it!,,,1618946375,{},gv8k9f8,True,t3_muggqk,False,True,t1_gv7t5jb,/r/hiking/comments/muggqk/grinnell_lake_overlook_on_grinnell_glacier_trail/gv8k9f8/,1618955974,2,True,False,hiking,t5_2r9om,,0,[],,
[],,k_marksthespot,,,[],,,,text,t2_3h9xbcna,False,True,[],"Many Glacier road (where this hike starts from) won’t open to even bicycles/walkers until may 28 due to road construction so it likely won’t open up to cars until mid to end of June I am sure! And the plowing is pretty on schedule to where it normally is for going to the sun road from what I have been told, so don’t think it will open up much earlier than normal either!",,,1618946360,{},gv8k87p,True,t3_muggqk,False,False,t1_gv7sln4,/r/hiking/comments/muggqk/grinnell_lake_overlook_on_grinnell_glacier_trail/gv8k87p/,1618955953,1,True,False,hiking,t5_2r9om,,0,[],,
[],,k_marksthespot,,,[],,,,text,t2_3h9xbcna,False,True,[],It’s not too bad! To get all the way up to the glacier (a couple miles past this spot) is about 11 miles round trip and about 2000 feet gain over that full 5.5 miles but I didn’t really feel the gain much!,,,1618946220,{},gv8jvvx,True,t3_muggqk,False,False,t1_gv7mg5o,/r/hiking/comments/muggqk/grinnell_lake_overlook_on_grinnell_glacier_trail/gv8jvvx/,1618955752,2,True,False,hiking,t5_2r9om,,0,[],,
[],,Now_is_fine229,,,[],,,,text,t2_a9lgdzu1,False,False,[],"How to not be annoying in any national park:

1) Stay on the trails, for your and your friends’ safety, if nothing else
2) Look for “picnic areas” or “day use areas” for hanging out in. 
3) Don’t litter.",,,1618946132,{},gv8jo54,False,t3_muxpf4,False,True,t3_muxpf4,/r/hiking/comments/muxpf4/what_is_picnic_etiquette_when_hiking/gv8jo54/,1618955624,2,True,False,hiking,t5_2r9om,,0,[],,
[],,k_marksthespot,,,[],,,,text,t2_3h9xbcna,False,True,[],Literally my favorite color!!,,,1618946129,{},gv8jntz,True,t3_muggqk,False,True,t1_gv7kstb,/r/hiking/comments/muggqk/grinnell_lake_overlook_on_grinnell_glacier_trail/gv8jntz/,1618955618,2,True,False,hiking,t5_2r9om,,0,[],,
[],,k_marksthespot,,,[],,,,text,t2_3h9xbcna,False,True,[],It definitely is really hard to get a bad photo!,,,1618946087,{},gv8jk5v,True,t3_muggqk,False,True,t1_gv7iglq,/r/hiking/comments/muggqk/grinnell_lake_overlook_on_grinnell_glacier_trail/gv8jk5v/,1618955560,2,True,False,hiking,t5_2r9om,,0,[],,
[],,Hikeonanon,,,[],,,,text,t2_9ec8pju5,False,True,[],"Appreciate you asking. The reason going off trail is frowned upon is because of the damage it can cause to plant life. But there will be more than enough spots in dirt or on rock you'll be able spot from the trail to have a picnic. You do need to be super careful if you're around water that's running swiftly. Not something to play with. Drowning is not uncommon and it's no way to go. What you do need to remember is to leave ZERO trace that you were there. Also, rock hunting is bad mojo. And illegal. You can't take anything from a national park. So please don't. And in terms of ""loud?"" Again, not cool. It disrupts others. If you let the quiet and calmness of being out there run the show, then you won't feel the need to be loud. Just groove on it. That's what you're there for. Have fun.",,,1618946066,{},gv8jiaj,False,t3_muxpf4,False,True,t3_muxpf4,/r/hiking/comments/muxpf4/what_is_picnic_etiquette_when_hiking/gv8jiaj/,1618955530,2,True,False,hiking,t5_2r9om,,0,[],,
[],,Syrah_volution,,,[],,,,text,t2_7oashl8z,False,False,[],"Phone cameras can be impressive, but are not capable of doing everything a camera can. If you think you want to print large photos to hang on a wall and remember those hikes, go with a camera. I have a Nikon Z50 and it is perfect for hiking. If you just want to share the memories digitally and have no plans of making prints, stick with a phone camera.",,,1618946064,{},gv8ji3b,False,t3_mu322j,False,True,t3_mu322j,/r/hiking/comments/mu322j/with_phone_cameras_getting_better_is_it_still/gv8ji3b/,1618955527,2,True,False,hiking,t5_2r9om,,0,[],,
[],,Eleannev,,,[],,,,text,t2_14oh4nse,False,False,[],Thank you for your quick n helpful response!,,,1618946025,{},gv8jeob,True,t3_muxpf4,False,True,t1_gv8iy7b,/r/hiking/comments/muxpf4/what_is_picnic_etiquette_when_hiking/gv8jeob/,1618955471,0,True,False,hiking,t5_2r9om,,0,[],,
[],,bailey757,,,[],,,,text,t2_6drvc,False,False,[],"10 miles RT, total gain is about 4500'. It has sections where scrambling is involved. https://www.wta.org/go-hiking/hikes/mount-st-helens-monitor-ridge",,,1618945970,{},gv8j9yz,True,t3_mus6cq,False,True,t1_gv8iyf2,/r/hiking/comments/mus6cq/a_bluebird_day_at_mt_st_helens_washington_usa/gv8j9yz/,1618955393,3,True,False,hiking,t5_2r9om,,0,[],,
[],,Miller1128,,,[],,,,text,t2_5kth0f6k,False,False,[],"Stay near the trail.  Going off it slightly won’t be a big deal.  Don’t be loud, sound carries very far outside.  Especially this time of year.  Most importantly: Clean up after yourselves.  Anything you bring in, you pack out.",,,1618945929,{},gv8j6c5,False,t3_muxpf4,False,True,t3_muxpf4,/r/hiking/comments/muxpf4/what_is_picnic_etiquette_when_hiking/gv8j6c5/,1618955334,0,True,False,hiking,t5_2r9om,,0,[],,
[],,sunkenbeetle,,,[],,,,text,t2_5pq8jwds,False,False,[],"Kinda hard to go wrong, honestly. In June I would not venture too high up...there will likely still be a lot of snow.",,,1618945904,{},gv8j458,False,t3_muwohq,False,True,t1_gv8hiha,/r/hiking/comments/muwohq/for_those_with_experience_at_rocky_mountain_np/gv8j458/,1618955295,1,True,False,hiking,t5_2r9om,,0,[],,
[],,ProdigyRunt,,,[],,,,text,t2_ach88,False,False,[],Thanks! I can't find details about the Monitor Ridge route. What is its approximate distance and elevation gain?,,,1618945837,{},gv8iyf2,False,t3_mus6cq,False,True,t1_gv88ja1,/r/hiking/comments/mus6cq/a_bluebird_day_at_mt_st_helens_washington_usa/gv8iyf2/,1618955198,2,True,False,hiking,t5_2r9om,,0,[],,
[],,Nightmareyesss,,,[],,,,text,t2_6mhweutc,False,False,[],still not great but more socially acceptable,,,1618945834,{},gv8iy7b,False,t3_muxpf4,False,False,t1_gv8irtw,/r/hiking/comments/muxpf4/what_is_picnic_etiquette_when_hiking/gv8iy7b/,1618955193,-1,True,False,hiking,t5_2r9om,,0,[],,
[],,bailey757,,,[],,,,text,t2_6drvc,False,False,[],"Yuppp- I think they were a bit further away than the photo makes it look, due to the zoom lens. But yea those cornices are sketch and were especially windblown",,,1618945823,{},gv8ix7h,True,t3_mus6cq,False,True,t1_gv8c2ut,/r/hiking/comments/mus6cq/a_bluebird_day_at_mt_st_helens_washington_usa/gv8ix7h/,1618955177,1,True,False,hiking,t5_2r9om,,0,[],,
[],,Eleannev,,,[],,,,text,t2_14oh4nse,False,False,[],Would going off trail outside of a park be appropriate?,,,1618945763,{},gv8irtw,True,t3_muxpf4,False,True,t1_gv8i8kt,/r/hiking/comments/muxpf4/what_is_picnic_etiquette_when_hiking/gv8irtw/,1618955087,1,True,False,hiking,t5_2r9om,,0,[],,
[],,bailey757,,,[],,,,text,t2_6drvc,False,False,[],"You'll absolutely work up a sweat. It was a pretty warm day- probably around 30 at the parking lot at 4am start time, and up to mid 40s on the mountain by midday. Always hard to tell the temp with the wind, but that sun is intense. Layers and sun protection are key.

I ended up wearing just thin REI hiking (zipoff) pants, a thin soft shell jacket, and a long sleeve base layer. Honestly would have been quite comfortable without the jacket, so long as I was moving. I brought a packable down puffer for the rim but didn't end up wearing it, as fortunately the wind had calmed down.",,,1618945699,{},gv8im6f,True,t3_mus6cq,False,True,t1_gv88spi,/r/hiking/comments/mus6cq/a_bluebird_day_at_mt_st_helens_washington_usa/gv8im6f/,1618954994,2,True,False,hiking,t5_2r9om,,0,[],,
[],,embryoeggnog,,,[],,,,text,t2_8alfkdy,False,False,[],In a national park you’re supposed to stay on the trail so you don’t damage the surrounding lands,,,1618945547,{},gv8i8kt,False,t3_muxpf4,False,True,t3_muxpf4,/r/hiking/comments/muxpf4/what_is_picnic_etiquette_when_hiking/gv8i8kt/,1618954762,1,True,False,hiking,t5_2r9om,,0,[],,
[],,bailey757,,,[],,,,text,t2_6drvc,False,False,[],"The final push at Mailbox is very similar- actually maybe even steeper, on average, but way shorter distance. But lots more pretty things to look up while working your way up MSH",,,1618945538,{},gv8i7qf,True,t3_mus6cq,False,True,t1_gv8fg10,/r/hiking/comments/mus6cq/a_bluebird_day_at_mt_st_helens_washington_usa/gv8i7qf/,1618954748,2,True,False,hiking,t5_2r9om,,0,[],,
[],,bailey757,,,[],,,,text,t2_6drvc,False,False,[],Aw hell yea,,,1618945453,{},gv8i09d,True,t3_mus6cq,False,True,t1_gv8gatb,/r/hiking/comments/mus6cq/a_bluebird_day_at_mt_st_helens_washington_usa/gv8i09d/,1618954629,2,True,False,hiking,t5_2r9om,,0,[],,
