all_awardings,associated_award,author,author_flair_background_color,author_flair_css_class,author_flair_richtext,author_flair_template_id,author_flair_text,author_flair_text_color,author_flair_type,author_fullname,author_patreon_flair,author_premium,awarders,body,collapsed_because_crowd_control,comment_type,created_utc,gildings,id,is_submitter,link_id,locked,no_follow,parent_id,permalink,retrieved_on,score,send_replies,stickied,subreddit,subreddit_id,top_awarded_type,total_awards_received,treatment_tags,distinguished,author_cakeday
[],,TheOtherWhiteWizard,,,[],,,,text,t2_b6ynlo2s,False,False,[],One of my favorite places to hike in southern IL,,,1618790856,{},gv0ya1b,False,t3_mtkmx0,False,True,t3_mtkmx0,/r/hiking/comments/mtkmx0/bell_smith_springs_illinois/gv0ya1b/,1618794147,1,True,False,hiking,t5_2r9om,,0,[],,
[],,PurpleWhatevs,,,[],,,,text,t2_l0i0c,False,True,[],I've been there. The drive was truly long af haha.,,,1618790831,{},gv0y8dv,False,t3_mtj7fq,False,True,t3_mtj7fq,/r/hiking/comments/mtj7fq/quite_a_drive_but_a_relatively_easy_hike_into_the/gv0y8dv/,1618794124,1,True,False,hiking,t5_2r9om,,0,[],,
[],,AutoModerator,,,[],,,,text,t2_6l4z3,False,True,[],"
I see you've posted an image.  Thanks for your contribution!

*Did you included the* ***required*** *title information?*  **[Your text.] [Most Specific place], [Specific place], [General place], [COUNTRY].**  
      
If you didn't include this information, please delete your post and resubmit it.  **Your post will be removed without warning if it does not follow this rule!**


*I am a bot, and this action was performed automatically. Please [contact the moderators of this subreddit](/message/compose/?to=/r/hiking) if you have any questions or concerns.*",,,1618790351,{},gv0xck5,False,t3_mtootv,False,True,t3_mtootv,/r/hiking/comments/mtootv/lick_creek_near_paoli_indiana/gv0xck5/,1618793669,1,False,False,hiking,t5_2r9om,,0,[],moderator,
[],,TrontRaznik,,,[],,,,text,t2_lbeg2ki,False,False,[],You literally posted a picture of someone hiking in jeans. Where's the assumption?,,,1618790169,{},gv0x0h3,False,t3_mtngs2,False,True,t1_gv0w4kh,/r/hiking/comments/mtngs2/convict_lake_ca/gv0x0h3/,1618793493,1,True,False,hiking,t5_2r9om,,0,[],,
[],,Initial-Macaron-9139,,,[],,,,text,t2_76l1eypa,False,False,[],"I totally agree! As an avid backpacker I am aware that it is better to wear synthetic or wool to stay warm and dry. However, my boyfriend and I were 2 minutes from the car and not actually hiking, so that being said please don’t make assumptions :)",,,1618789696,{},gv0w4kh,True,t3_mtngs2,False,True,t1_gv0vr4i,/r/hiking/comments/mtngs2/convict_lake_ca/gv0w4kh/,1618793035,1,True,False,hiking,t5_2r9om,,0,[],,
[],,TrontRaznik,,,[],,,,text,t2_lbeg2ki,False,False,[],"Please don't hike in jeans! Google ""cotton kills"". It's incredibly dangerous to wear it in the backcountry and in the winter especially.",,,1618789496,{},gv0vr4i,False,t3_mtngs2,False,True,t3_mtngs2,/r/hiking/comments/mtngs2/convict_lake_ca/gv0vr4i/,1618792842,1,True,False,hiking,t5_2r9om,,0,[],,
[],,BigTnT,,,[],,,,text,t2_l54ryqw,False,False,[],"This is pretty random but do you use cameras that push images automatically? If not, is there interest? 

I was talking to some friends the other day and they expressed a need for something like that since it's a pain to go retrieve all the images. I looked around and didn't see any great options. I'm asking out of personal interest. Maybe it will motivate me to build a product.

Anyway cool pic!",,,1618789391,{},gv0vjtl,False,t3_msskp6,False,True,t1_guwqg7l,/r/hiking/comments/msskp6/remote_camera_mt_hood_oregon_from_my_tracking/gv0vjtl/,1618792738,1,True,False,hiking,t5_2r9om,,0,[],,
[],,burchsbetrippin,,,[],,,,text,t2_2shcjhfo,False,False,[],"when you’ve seen it, you never un-see it. i was rapid scrolling and said, “ohh, plitvice!” and scrolled back up. i teared up three times there",,,1618789338,{},gv0vg6m,False,t3_mtbanx,False,True,t3_mtbanx,/r/hiking/comments/mtbanx/plitvice_lakes_croatia/gv0vg6m/,1618792684,1,True,False,hiking,t5_2r9om,,0,[],,
[],,zuppi63,,,[],,,,text,t2_3fhytqsq,False,False,[],Though huh😀 congrats...did it in 2019...next time it’ll come up it’s gonna be...nah thanks...been there done that😀,,,1618788489,{},gv0tsti,False,t3_mtixsh,False,True,t3_mtixsh,/r/hiking/comments/mtixsh/did_the_manitou_incline_last_week_for_the_1st_time/gv0tsti/,1618791843,1,True,False,hiking,t5_2r9om,,0,[],,
[],,ssh7201,,,[],,,,text,t2_12yu80l1,False,False,[],"Looks like a great team, I am a one man team so far, wifey isn't into hiking but we are expecting a baby boy in September and can't wait to hike with him. That's kinda what made me ask for the photo 😎",,,1618788372,{},gv0tkp8,False,t3_msf440,False,True,t1_guy0yty,/r/hiking/comments/msf440/finally_got_out_to_backpack_around_canyons_for/gv0tkp8/,1618791726,1,True,False,hiking,t5_2r9om,,0,[],,
[],,AutoModerator,,,[],,,,text,t2_6l4z3,False,True,[],"
I see you've posted an image.  Thanks for your contribution!

*Did you included the* ***required*** *title information?*  **[Your text.] [Most Specific place], [Specific place], [General place], [COUNTRY].**  
      
If you didn't include this information, please delete your post and resubmit it.  **Your post will be removed without warning if it does not follow this rule!**


*I am a bot, and this action was performed automatically. Please [contact the moderators of this subreddit](/message/compose/?to=/r/hiking) if you have any questions or concerns.*",,,1618788110,{},gv0t1wo,False,t3_mto1mc,False,True,t3_mto1mc,/r/hiking/comments/mto1mc/hiking_in_southern_new_mexico/gv0t1wo/,1618791457,1,False,False,hiking,t5_2r9om,,0,[],moderator,
[],,Initial-Macaron-9139,,,[],,,,text,t2_76l1eypa,False,False,[],Ah me too! It’s so beautiful anytime of year,,,1618787936,{},gv0sp8c,True,t3_mtngs2,False,True,t1_gv0slv3,/r/hiking/comments/mtngs2/convict_lake_ca/gv0sp8c/,1618791272,1,True,False,hiking,t5_2r9om,,0,[],,
[],,FTBLAZER,,,[],,,,text,t2_bvx0w,False,False,[],I love convict lake!,,,1618787889,{},gv0slv3,False,t3_mtngs2,False,True,t3_mtngs2,/r/hiking/comments/mtngs2/convict_lake_ca/gv0slv3/,1618791224,2,True,False,hiking,t5_2r9om,,0,[],,
[],,expiredprince,,,[],,,,text,t2_96v59ktv,False,False,[],I did it. One of the best experiences of my life. 12 days,,,1618787760,{},gv0scug,False,t3_mtjr74,False,True,t1_gv06hhg,/r/hiking/comments/mtjr74/tahoe_rim_trail_map/gv0scug/,1618791094,2,True,False,hiking,t5_2r9om,,0,[],,
[],,antibeen,,,[],,,,text,t2_fn0q3,False,False,[],"“*This hidden gem is right here on the map!!*”

Lol something about claiming something to be great due to it being hidden... and then immediately giving directions strikes me as funny.",,,1618787678,{},gv0s70n,False,t3_mt5r5k,False,True,t3_mt5r5k,/r/hiking/comments/mt5r5k/this_hidden_gem_is_right_off_of_89_in_southern/gv0s70n/,1618791010,1,True,False,hiking,t5_2r9om,,0,[],,
[],,Initial-Macaron-9139,,,[],,,,text,t2_76l1eypa,False,False,[],A group of convicts escaped from a prison in Carson City and made camp here. They were eventually caught tho,,,1618787592,{},gv0s0qo,True,t3_mtngs2,False,True,t1_gv0r991,/r/hiking/comments/mtngs2/convict_lake_ca/gv0s0qo/,1618790919,1,True,False,hiking,t5_2r9om,,0,[],,
[],,samm0203,,,[],,,,text,t2_bkxo56wv,False,False,[],Climbers,,,1618787353,{},gv0rjo3,True,t3_mtknbt,False,True,t1_gv0nclc,/r/hiking/comments/mtknbt/beautiful_scenery_in_andorra/gv0rjo3/,1618790674,1,True,False,hiking,t5_2r9om,,0,[],,
[],,Allphunkedup,,,[],,,,text,t2_p6isw8c,False,False,[],Why is it called that?,,,1618787204,{},gv0r991,False,t3_mtngs2,False,True,t3_mtngs2,/r/hiking/comments/mtngs2/convict_lake_ca/gv0r991/,1618790529,2,True,False,hiking,t5_2r9om,,0,[],,
[],,AutoModerator,,,[],,,,text,t2_6l4z3,False,True,[],"
I see you've posted an image.  Thanks for your contribution!

*Did you included the* ***required*** *title information?*  **[Your text.] [Most Specific place], [Specific place], [General place], [COUNTRY].**  
      
If you didn't include this information, please delete your post and resubmit it.  **Your post will be removed without warning if it does not follow this rule!**


*I am a bot, and this action was performed automatically. Please [contact the moderators of this subreddit](/message/compose/?to=/r/hiking) if you have any questions or concerns.*",,,1618787095,{},gv0r1p2,False,t3_mtnqql,False,True,t3_mtnqql,/r/hiking/comments/mtnqql/when_you_take_your_friend_out_hiking_for_the_first/gv0r1p2/,1618790419,1,False,False,hiking,t5_2r9om,,0,[],moderator,
[],,ishWishy,,,[],,,,text,t2_1zo7hlfb,False,False,[],You could be right. Been about 30 years since I’ve been in NC. But I do have a memory on a clear day looking out from some spot up in the Blue Ridge Mountains and seeing skyscrapers way way off at the horizon and my NC friend telling me it was Charlotte.,,,1618786986,{},gv0qtvc,False,t3_mscnnl,False,True,t1_gv0pa2o,/r/hiking/comments/mscnnl/hiking_pilot_mountain_north_carolina_oc_it_is_a/gv0qtvc/,1618790306,1,True,False,hiking,t5_2r9om,,0,[],,
[],,stryker815,,,[],,,,text,t2_2tjeadsr,False,False,[],Where is this at?,,,1618786390,{},gv0po8x,False,t3_jg5cfe,False,True,t3_jg5cfe,/r/hiking/comments/jg5cfe/bumpass_hell_trail_in_california_bubbling/gv0po8x/,1618789706,1,True,False,hiking,t5_2r9om,,0,[],,
[],,melsuit,,,[],,,,text,t2_2ufd10ji,False,False,[],Such a pretty snow waterfall. Glad that you got to see it from a safe distance instead of being in it.,,,1618786344,{},gv0pl01,False,t3_mtkbdr,False,True,t3_mtkbdr,/r/hiking/comments/mtkbdr/avalanche_season_is_upon_us/gv0pl01/,1618789660,1,True,False,hiking,t5_2r9om,,0,[],,
[],,latexflesh,,,[],,,,text,t2_9qd306w0,False,False,[],I believe you are thinking of Crowders Mountain outside of Charlotte. This mountain is between Winston-Salem and Mount Airy.,,,1618786189,{},gv0pa2o,True,t3_mscnnl,False,True,t1_gushvfv,/r/hiking/comments/mscnnl/hiking_pilot_mountain_north_carolina_oc_it_is_a/gv0pa2o/,1618789505,1,True,False,hiking,t5_2r9om,,0,[],,
[],,KaoriiiChan,,,[],,,,text,t2_278g3k6x,False,False,[],It was very peaceful too!,,,1618785951,{},gv0otdd,True,t3_mtlhyi,False,True,t1_gv0o9qx,/r/hiking/comments/mtlhyi/spent_a_few_hours_at_codorus_state_park_in_york/gv0otdd/,1618789267,1,True,False,hiking,t5_2r9om,,0,[],,
[],,youngsavage216,,,[],,,,text,t2_4q37qj0o,False,False,[],Good to know I’ll definitely be jumping in that water,,,1618785839,{},gv0olkt,False,t3_mtbanx,False,True,t1_gv0ka56,/r/hiking/comments/mtbanx/plitvice_lakes_croatia/gv0olkt/,1618789154,1,True,False,hiking,t5_2r9om,,0,[],,
[],,AWiseManOnceSay,,,[],,,,text,t2_a5or7wor,False,False,[],Looks pleasant,,,1618785670,{},gv0o9qx,False,t3_mtlhyi,False,False,t3_mtlhyi,/r/hiking/comments/mtlhyi/spent_a_few_hours_at_codorus_state_park_in_york/gv0o9qx/,1618788983,2,True,False,hiking,t5_2r9om,,0,[],,
[],,AutoModerator,,,[],,,,text,t2_6l4z3,False,True,[],"
I see you've posted an image.  Thanks for your contribution!

*Did you included the* ***required*** *title information?*  **[Your text.] [Most Specific place], [Specific place], [General place], [COUNTRY].**  
      
If you didn't include this information, please delete your post and resubmit it.  **Your post will be removed without warning if it does not follow this rule!**


*I am a bot, and this action was performed automatically. Please [contact the moderators of this subreddit](/message/compose/?to=/r/hiking) if you have any questions or concerns.*",,,1618785318,{},gv0nkcf,False,t3_mtn7cx,False,True,t3_mtn7cx,/r/hiking/comments/mtn7cx/hiking_around_salem_lake_winstonsalem_north/gv0nkcf/,1618788621,2,False,False,hiking,t5_2r9om,,0,[],moderator,
[],,Tiop,,,[],,,,text,t2_6f7sv,False,False,[],What kind of goats are those?,,,1618785210,{},gv0nclc,False,t3_mtknbt,False,True,t3_mtknbt,/r/hiking/comments/mtknbt/beautiful_scenery_in_andorra/gv0nclc/,1618788512,1,True,False,hiking,t5_2r9om,,0,[],,
[],,A_MossyMan,,,[],,,,text,t2_905e7285,False,False,[],"Tip for next time: If you keep going up to the second or third ledge , the number of people drops off significantly and you get a higher view. For whatever reason very few people keep going past the first one despite the third not being that much further. Happy hiking!",,,1618784938,{},gv0mspc,False,t3_msz9qe,False,True,t3_msz9qe,/r/hiking/comments/msz9qe/what_an_absolutely_breathtaking_hike_definitely/gv0mspc/,1618788220,1,True,False,hiking,t5_2r9om,,0,[],,
[],,Airmil82,,,[],,,,text,t2_6jq7oly,False,False,[],"Shawangunk Mountains, Lake Minnewaska SP, New Paltz, NY",,,1618784900,{},gv0mq1n,True,t3_mtlrmv,False,True,t3_mtlrmv,/r/hiking/comments/mtlrmv/my_day_trip_to_the_gunks/gv0mq1n/,1618788183,1,True,False,hiking,t5_2r9om,,0,[],,
[],,sequesterdoritos,,,[],,,,text,t2_44dboezm,False,False,[],"Yes, we have plenty of experience, I just didn’t want to give the vibe that we are avid climbers all the time. Thank you though, that is good to know as far as no turning back. More research ahead",,,1618784637,{},gv0m707,True,t3_msdsne,False,True,t1_guuj4w4,/r/hiking/comments/msdsne/looking_for_tips_on_capitol_peak_co/gv0m707/,1618787904,1,True,False,hiking,t5_2r9om,,0,[],,
[],,AutoModerator,,,[],,,,text,t2_6l4z3,False,True,[],"
I see you've posted an image.  Thanks for your contribution!

*Did you included the* ***required*** *title information?*  **[Your text.] [Most Specific place], [Specific place], [General place], [COUNTRY].**  
      
If you didn't include this information, please delete your post and resubmit it.  **Your post will be removed without warning if it does not follow this rule!**


*I am a bot, and this action was performed automatically. Please [contact the moderators of this subreddit](/message/compose/?to=/r/hiking) if you have any questions or concerns.*",,,1618784407,{},gv0lqiw,False,t3_mtmx28,False,True,t3_mtmx28,/r/hiking/comments/mtmx28/view_of_mount_hood_in_sandy_oregon_us/gv0lqiw/,1618787664,1,False,False,hiking,t5_2r9om,,0,[],moderator,
[],,AutoModerator,,,[],,,,text,t2_6l4z3,False,True,[],"
I see you've posted an image.  Thanks for your contribution!

*Did you included the* ***required*** *title information?*  **[Your text.] [Most Specific place], [Specific place], [General place], [COUNTRY].**  
      
If you didn't include this information, please delete your post and resubmit it.  **Your post will be removed without warning if it does not follow this rule!**


*I am a bot, and this action was performed automatically. Please [contact the moderators of this subreddit](/message/compose/?to=/r/hiking) if you have any questions or concerns.*",,,1618784329,{},gv0lkvp,False,t3_mtmw4x,False,True,t3_mtmw4x,/r/hiking/comments/mtmw4x/water_and_mountains_tarfalla_valley_sweden/gv0lkvp/,1618787582,1,False,False,hiking,t5_2r9om,,0,[],moderator,
[],,nicegirlfromthere,,,[],,,,text,t2_86kqphsc,False,False,[],Please look at the title 🙂,,,1618783911,{},gv0kqw8,True,t3_mtbanx,False,True,t1_gv05oav,/r/hiking/comments/mtbanx/plitvice_lakes_croatia/gv0kqw8/,1618787151,1,True,False,hiking,t5_2r9om,,0,[],,
[],,nicegirlfromthere,,,[],,,,text,t2_86kqphsc,False,False,[],"Omg! You are so lucky.  I love Croatia, your culture and people! ☺️ I've been there many times. This is my favourite place on earth.",,,1618783843,{},gv0klz7,True,t3_mtbanx,False,True,t1_gv0ihgw,/r/hiking/comments/mtbanx/plitvice_lakes_croatia/gv0klz7/,1618787081,1,True,False,hiking,t5_2r9om,,0,[],,
[],,nicegirlfromthere,,,[],,,,text,t2_86kqphsc,False,False,[],"When I was there couple of years ago, swimming in some lakes was allowed.",,,1618783678,{},gv0ka56,True,t3_mtbanx,False,True,t1_gv0args,/r/hiking/comments/mtbanx/plitvice_lakes_croatia/gv0ka56/,1618786906,1,True,False,hiking,t5_2r9om,,0,[],,
[],,Hazardous_Stud,,,[],,,,text,t2_b6odpxq4,False,False,[],What a calming place to be,,,1618783531,{},gv0jzm9,False,t3_mtbj9x,False,True,t3_mtbj9x,/r/hiking/comments/mtbj9x/upstate_ny_humid_day_photo_taken_by_myself_and_i/gv0jzm9/,1618786751,1,True,False,hiking,t5_2r9om,,0,[],,
[],,decayingtay,,,[],,,,text,t2_bkvh6anm,False,False,[],Lol the way the pup's face is popping up,,,1618783285,{},gv0jhwt,False,t3_mt4o3c,False,True,t3_mt4o3c,/r/hiking/comments/mt4o3c/bear_peak_boulder_co/gv0jhwt/,1618786494,1,True,False,hiking,t5_2r9om,,0,[],,
[],,decayingtay,,,[],,,,text,t2_bkvh6anm,False,False,[],Dope. That fog,,,1618783193,{},gv0jb7o,False,t3_mtkk2w,False,True,t3_mtkk2w,/r/hiking/comments/mtkk2w/into_the_abyss_rattlesnake_point_milton_ontario/gv0jb7o/,1618786395,1,True,False,hiking,t5_2r9om,,0,[],,
[],,[deleted],,,,,,dark,,,,,[],[deleted],,,1618782963,{},gv0iuav,False,t3_mtmg23,False,True,t3_mtmg23,/r/hiking/comments/mtmg23/winter_mountain_forest_switzerland_kanton_schwyz/gv0iuav/,1618786149,1,True,False,hiking,t5_2r9om,,0,[],,
[],,AutoModerator,,,[],,,,text,t2_6l4z3,False,True,[],"
I see you've posted an image.  Thanks for your contribution!

*Did you included the* ***required*** *title information?*  **[Your text.] [Most Specific place], [Specific place], [General place], [COUNTRY].**  
      
If you didn't include this information, please delete your post and resubmit it.  **Your post will be removed without warning if it does not follow this rule!**


*I am a bot, and this action was performed automatically. Please [contact the moderators of this subreddit](/message/compose/?to=/r/hiking) if you have any questions or concerns.*",,,1618782928,{},gv0irqq,False,t3_mtmg23,False,True,t3_mtmg23,/r/hiking/comments/mtmg23/winter_mountain_forest_switzerland_kanton_schwyz/gv0irqq/,1618786111,1,False,False,hiking,t5_2r9om,,0,[],moderator,
[],,Impressive-Ad8249,,,[],,,,text,t2_928ww2vv,False,False,[],My country! Hit me up if you have any questions,,,1618782792,{},gv0ihgw,False,t3_mtbanx,False,True,t3_mtbanx,/r/hiking/comments/mtbanx/plitvice_lakes_croatia/gv0ihgw/,1618785960,2,True,False,hiking,t5_2r9om,,0,[],,
[],,sugarplum_jellybean,,,[],,,,text,t2_4my6p7hc,False,False,[],"Yeah, looks great, but it's cold! When I was a kid, we'd go further down river (outside the NP) and freeze, but it was super fun... :)",,,1618782775,{},gv0ig62,False,t3_mtbanx,False,False,t1_gv0dms0,/r/hiking/comments/mtbanx/plitvice_lakes_croatia/gv0ig62/,1618785941,2,True,False,hiking,t5_2r9om,,0,[],,
[],,AutoModerator,,,[],,,,text,t2_6l4z3,False,True,[],"
I see you've posted an image.  Thanks for your contribution!

*Did you included the* ***required*** *title information?*  **[Your text.] [Most Specific place], [Specific place], [General place], [COUNTRY].**  
      
If you didn't include this information, please delete your post and resubmit it.  **Your post will be removed without warning if it does not follow this rule!**


*I am a bot, and this action was performed automatically. Please [contact the moderators of this subreddit](/message/compose/?to=/r/hiking) if you have any questions or concerns.*",,,1618782548,{},gv0hyzj,False,t3_mtmbqz,False,True,t3_mtmbqz,/r/hiking/comments/mtmbqz/hike_at_tabor_falls_today_mount_airy_ga/gv0hyzj/,1618785689,1,False,False,hiking,t5_2r9om,,0,[],moderator,
[],,Jazzlike-Cricket4835,,,[],,,,text,t2_8lafwe40,False,False,[],Me 2,,,1618781855,{},gv0gk1q,True,t3_mtkmx0,False,True,t1_gv0cun0,/r/hiking/comments/mtkmx0/bell_smith_springs_illinois/gv0gk1q/,1618784937,1,True,False,hiking,t5_2r9om,,0,[],,
[],,Meouppe,,,[],,,,text,t2_bi40r993,False,False,[],Thanks! It was amazing looking over the edge!,,,1618781694,{},gv0g81p,True,t3_mtkk2w,False,False,t1_gv0ebox,/r/hiking/comments/mtkk2w/into_the_abyss_rattlesnake_point_milton_ontario/gv0g81p/,1618784762,2,True,False,hiking,t5_2r9om,,0,[],,
[],,afavorite08,,,[],,,,text,t2_2g0mjrjk,False,False,[],"Good job! That’s a fun hike with great views, but you gotta work for it. 😄",,,1618780968,{},gv0eq0c,False,t3_mthu01,False,True,t3_mthu01,/r/hiking/comments/mthu01/my_first_solo_hike_to_rattlesnake_ledge_northbend/gv0eq0c/,1618783947,1,True,False,hiking,t5_2r9om,,0,[],,
[],,TrixieGore,,,[],,,,text,t2_6cc1ozra,False,False,[],Cool picture! I love fog...,,,1618780781,{},gv0ebox,False,t3_mtkk2w,False,True,t3_mtkk2w,/r/hiking/comments/mtkk2w/into_the_abyss_rattlesnake_point_milton_ontario/gv0ebox/,1618783738,1,True,False,hiking,t5_2r9om,,0,[],,
[],,Mentalfloss1,,,[],,,,text,t2_al7pc,False,True,[],If you’re bored and interested her are 10 or so snowshoe pics:  http://www.backpackingamericanwest.com/snowshoeing---mt-hood.html,,,1618780718,{},gv0e6vm,True,t3_msskp6,False,True,t1_guxn9vw,/r/hiking/comments/msskp6/remote_camera_mt_hood_oregon_from_my_tracking/gv0e6vm/,1618783668,1,True,False,hiking,t5_2r9om,,0,[],,
[],,youngsavage216,,,[],,,,text,t2_4q37qj0o,False,False,[],Thanks bud! Just thought I’d ask water looks very inviting lol,,,1618780449,{},gv0dms0,False,t3_mtbanx,False,True,t1_gv0dhq1,/r/hiking/comments/mtbanx/plitvice_lakes_croatia/gv0dms0/,1618783367,1,True,False,hiking,t5_2r9om,,0,[],,
[],,sugarplum_jellybean,,,[],,,,text,t2_4my6p7hc,False,False,[],Swimmimg is not allowed,,,1618780381,{},gv0dhq1,False,t3_mtbanx,False,True,t1_gv0args,/r/hiking/comments/mtbanx/plitvice_lakes_croatia/gv0dhq1/,1618783290,2,True,False,hiking,t5_2r9om,,0,[],,
[],,samm0203,,,[],,,,text,t2_bkxo56wv,False,False,[],"Yeah its a really beautiful area, I think its limestone",,,1618780169,{},gv0d1md,True,t3_mtknbt,False,True,t1_gv0bqw5,/r/hiking/comments/mtknbt/beautiful_scenery_in_andorra/gv0d1md/,1618783047,1,True,False,hiking,t5_2r9om,,0,[],,
[],,Titties_McGubbin,,,[],,,,text,t2_8hdqh7pe,False,False,[],I ❤️ so.ill.,,,1618780078,{},gv0cun0,False,t3_mtkmx0,False,True,t3_mtkmx0,/r/hiking/comments/mtkmx0/bell_smith_springs_illinois/gv0cun0/,1618782944,2,True,False,hiking,t5_2r9om,,0,[],,
[],,Ominous_Brew,,,[],,,,text,t2_8w7m0,False,False,[],"You can see all the tourists on the bridge.

It's a beautiful place, but I absolutely hated it. I've hardly been anywhere in nature so packed with obnoxious tourists.",,,1618779834,{},gv0cbdk,False,t3_mtbanx,False,True,t1_guypvt3,/r/hiking/comments/mtbanx/plitvice_lakes_croatia/gv0cbdk/,1618782658,1,True,False,hiking,t5_2r9om,,0,[],,
[],,Shakespeare-Bot,,,[],,,,text,t2_ajjeyose,False,True,[],"Croatia hast at each moment been on mine own bucket list, but anon i has't a gorgeous new spot to add!

***



^(I am a bot and I swapp'd some of thy words with Shakespeare words.)

Commands: `!ShakespeareInsult`, `!fordo`, `!optout`",,,1618779756,{},gv0c5dg,False,t3_mtbanx,False,True,t1_gv0c4av,/r/hiking/comments/mtbanx/plitvice_lakes_croatia/gv0c5dg/,1618782566,1,True,False,hiking,t5_2r9om,,0,[],,
[],,No-Try-1028,,,[],,,,text,t2_8l1ptfve,False,False,[],"Croatia has always been on my bucket list, but now I have a gorgeous new spot to add!",,,1618779741,{},gv0c4av,False,t3_mtbanx,False,True,t3_mtbanx,/r/hiking/comments/mtbanx/plitvice_lakes_croatia/gv0c4av/,1618782550,1,True,False,hiking,t5_2r9om,,0,[],,
[],,iamvegenaut,,,[],,,,text,t2_5k662942,False,False,[],Is that limestone? Beautiful area!,,,1618779569,{},gv0bqw5,False,t3_mtknbt,False,True,t3_mtknbt,/r/hiking/comments/mtknbt/beautiful_scenery_in_andorra/gv0bqw5/,1618782352,2,True,False,hiking,t5_2r9om,,0,[],,
[],,Hurricaneshand,,,[],,,,text,t2_4d50b6q5,False,False,[],Haven't been in a decade or more but looks great!  Definitely on my list to go now I'm back into hiking!,,,1618779457,{},gv0bi7v,False,t3_mtdp3y,False,True,t3_mtdp3y,/r/hiking/comments/mtdp3y/behind_the_waterfall_at_cloudland_canyon_state/gv0bi7v/,1618782224,1,True,False,hiking,t5_2r9om,,0,[],,
[],,kenzi794,,,[],,,,text,t2_4mqjxo,False,False,[],"I recommend Leavenworth, WA. Not too far from Seattle. Absolutely breathtaking hiking nearby-The Enchantments. You need a permit to backpack but you can say hike without one. Colchuck Lake is stunning.",,,1618779426,{},gv0bfwb,False,t3_mrf7a5,False,True,t3_mrf7a5,/r/hiking/comments/mrf7a5/visiting_seattle_too_many_choices/gv0bfwb/,1618782187,1,True,False,hiking,t5_2r9om,,0,[],,
[],,youngsavage216,,,[],,,,text,t2_4q37qj0o,False,False,[],Is it possible to swim there just wondering always wanted to go,,,1618779105,{},gv0args,False,t3_mtbanx,False,True,t3_mtbanx,/r/hiking/comments/mtbanx/plitvice_lakes_croatia/gv0args/,1618781812,1,True,False,hiking,t5_2r9om,,0,[],,
[],,Mentalfloss1,,,[],,,,text,t2_al7pc,False,True,[],"I love snowshoeing but most ever snowshoe area is a mess now.  Getting way off trail is the only way. 

You were lucky!! That’s great. It’s a pretty area.",,,1618778675,{},gv09uqy,True,t3_msskp6,False,True,t1_guxn9vw,/r/hiking/comments/msskp6/remote_camera_mt_hood_oregon_from_my_tracking/gv09uqy/,1618781315,1,True,False,hiking,t5_2r9om,,0,[],,
[],,Mentalfloss1,,,[],,,,text,t2_al7pc,False,True,[],It does.  Life isn’t often fair.  🙂,,,1618778535,{},gv09k98,True,t3_msskp6,False,True,t1_guxutj2,/r/hiking/comments/msskp6/remote_camera_mt_hood_oregon_from_my_tracking/gv09k98/,1618781156,1,True,False,hiking,t5_2r9om,,0,[],,
[],,speedbumptx,,,[],,,,text,t2_87d35g9f,False,False,[],Did that beast once for PT when I was stationed at Ft Carson. Congrats!,,,1618778369,{},gv097pw,False,t3_mtixsh,False,True,t3_mtixsh,/r/hiking/comments/mtixsh/did_the_manitou_incline_last_week_for_the_1st_time/gv097pw/,1618780959,1,True,False,hiking,t5_2r9om,,0,[],,
[],,FitnessandFells,,,[],,,,text,t2_7kyenjfs,False,False,[],Very much so!,,,1618778232,{},gv08xd6,True,t3_mti9kb,False,True,t1_gv08msr,/r/hiking/comments/mti9kb/scrambling_up_gordale_scar_malham_north_yorkshire/gv08xd6/,1618780804,1,True,False,hiking,t5_2r9om,,0,[],,
[],,samm0203,,,[],,,,text,t2_bkxo56wv,False,False,[],The onion 🤣🤣,,,1618778096,{},gv08mzj,True,t3_mtknbt,False,True,t1_gv08hp8,/r/hiking/comments/mtknbt/beautiful_scenery_in_andorra/gv08mzj/,1618780649,2,True,False,hiking,t5_2r9om,,0,[],,
[],,Ehbonkei,,,[],,,,text,t2_a9hie,False,False,[],I absolutely loved this! Such an adventure.,,,1618778093,{},gv08msr,False,t3_mti9kb,False,True,t3_mti9kb,/r/hiking/comments/mti9kb/scrambling_up_gordale_scar_malham_north_yorkshire/gv08msr/,1618780646,2,True,False,hiking,t5_2r9om,,0,[],,
